元朗冰室 Yuen Long Bistro,17.0,深水埗元州街1號地下,$50以下,港式,茶餐廳/冰室,(28 食評),622,
八仙餅家,66.0,深水埗南昌街197號地下,$50以下,港式,唐餅,(107 食評),2625,
三多炸肶 Santos,13.0,深水埗元州街162-188號天悅廣場地下A4舖,$50以下,港式,小食店,(26 食評),842,
黃金冰室 Golden Cafe,10.0,深水埗欽州街55號地舖,$50以下,港式,茶餐廳/冰室,(19 食評),309,
九龍餐室 Kowloon Restaurant,51.0,深水埗汝州街282號地下,$50以下,港式,茶餐廳/冰室,(95 食評),1461,
福龍門海鮮火鍋酒家,10.0,深水埗長沙灣道270號御匯大廈1樓,$101-200,港式,火鍋,(17 食評),1149,
藍山咖啡專門店 Blue Mountain Cafe,24.0,深水埗荔枝角道289號,$50以下,港式,港式,(34 食評),1371,
春潤堂,15.0,深水埗大埔道14-16號華都大廈2號舖,$50以下,車仔麵,港式,(25 食評),2246,
強記大排檔,36.0,深水埗基隆街219號地下,$51-100,港式,海鮮,(56 食評),1915,
新聯豐粉麵家,32.0,深水埗桂林街143號地下,$50以下,港式,茶餐廳/冰室,(46 食評),533,
媽咪雞蛋仔 Mammy Pancake,12.0,深水埗福榮街92-98號常福大廈地舖,$50以下,港式,小食店,(19 食評),166,
標叔叔小食店,25.0,深水埗福榮街90號A,$50以下,港式,小食店,(42 食評),653,
新香園,10.0,深水埗汝州街186號地舖,$50以下,港式,茶餐廳/冰室,(24 食評),559,
林昌記 Lam Cheong Kee,11.0,深水埗欽州街57-63號冠奇大廈地下4號舖,$50以下,港式,小食店,(18 食評),572,
嵩記牛什,24.0,深水埗大埔道142號地舖,$50以下,港式,粉麵/米線,(37 食評),1704,
南昌冰室 Nam Cheong Cafe Shop,11.0,深水埗汝州街204-206號地下,$50以下,港式,茶餐廳/冰室,(28 食評),762,
自家廚房 Amazing Kitchen,9.0,深水埗欽州街37號西九龍中心2樓212C號舖,$51-100,港式,茶餐廳/冰室,(18 食評),239,
金華美食,13.0,深水埗昌華街20號金華閣地下1號舖,$50以下,港式,小食店,(16 食評),634,
來多客餐廳,16.0,深水埗元州街154號地舖,$50以下,港式,茶餐廳/冰室,(33 食評),167,
長發麵家 Cheung Fat Noodles,10.0,深水埗耀東街14號地下,$50以下,港式,粉麵/米線,(14 食評),1445,
星河餐廳,22.0,深水埗大南街374號,$51-100,港式,港式,(31 食評),899,
龍運燒味火鍋茶餐廳,8.0,深水埗福華街51D號地下,$101-200,港式,火鍋,(13 食評),576,
大師傅,8.0,深水埗長沙灣道270號御匯地下,$50以下,港式,茶餐廳/冰室,(19 食評),146,
天祥飯店,29.0,深水埗石硤尾街醫局街98號利德昌大廈側,$101-200,港式,大牌檔,(37 食評),1307,
北河同行,8.0,深水埗大南街278號地下,$50以下,港式,茶餐廳/冰室,(13 食評),633,
榮家糕點烘培店 Wings Bakery,6.0,深水埗桂林街50A號地下2號舖,$50以下,港式,麵包店,(7 食評),234,
正斗火鍋 Yummy Hot Pot,11.0,深水埗順寧道25號薈悅地下8號舖及1樓,$101-200,港式,火鍋,(20 食評),307,送 25里數 / 30積分
金和記海鮮菜館,7.0,深水埗九江街,$101-200,港式,火鍋,(15 食評),1508,
品庭火鍋 Bun Ting,11.0,深水埗福榮街47號地舖,$101-200,港式,火鍋,(13 食評),57,
豪城茶餐廳 Ho Shing Restaurant,19.0,深水埗元州街 131-133 號地舖,$50以下,港式,快餐店,(34 食評),210,
糖水佬甜品 Tong Shui Lo Dessert,77.0,深水埗桂林街143號地下G號舖 (近福榮街),$50以下,港式,甜品/糖水,(155 食評),763,
北河燒臘飯店,21.0,深水埗北河街54號地下,$50以下,港式,燒臘,(37 食評),946,
合興旺茶餐廳,15.0,深水埗青山道23號華盛大廈地下23C舖,$50以下,港式,茶餐廳/冰室,(22 食評),932,
囍囍美食,20.0,深水埗福榮街125號,$50以下,港式,小食店,(54 食評),494,
翠麗餐廳,10.0,深水埗大埔道18號地下,$51-100,港式,茶餐廳/冰室,(12 食評),314,
金翠餐廳,19.0,深水埗福華街124號地舖,$50以下,港式,燒臘,(41 食評),345,
燒鵝大皇,,深水埗福榮街119號地下,$50以下,港式,燒臘,(52 食評),626,
明發茶室,5.0,深水埗基隆街239號地舖,$50以下,港式,粉麵/米線,(10 食評),589,
智多星 Lucky Star Delicious Food,20.0,深水埗營盤街 145 號地下,$50以下,港式,粉麵/米線,(35 食評),486,
大家食 Eat Together,105.0,深水埗福榮街80號地下,$50以下,港式,粉麵/米線,(157 食評),568,
三洋餐廳 Sanyang,13.0,深水埗汝州街264號地下,$50以下,港式,茶餐廳/冰室,(30 食評),148,
生龍清湯腩,37.0,深水埗褔榮街99號地下,$50以下,港式,粉麵/米線,(86 食評),431,
賓墟餐廳 Bun Hui Restaurant,8.0,深水埗青山道154號地舖,$51-100,港式,茶餐廳/冰室,(19 食評),119,
華南冰室,21.0,深水埗桂林街87號地舖,$50以下,港式,粉麵/米線,(45 食評),655,
龍鳯廚坊,4.0,深水埗白楊街21號地舖,$101-200,港式,港式,(8 食評),199,
功夫點心 Kung Fu Dim Sum,4.0,深水埗福榮街68及70號地舖,$50以下,港式,點心,(10 食評),91,
七木橋車仔麵,5.0,深水埗欽州街37號西九龍中心8樓8F27號舖,$50以下,車仔麵,港式,(11 食評),81,
大利美食中心 BBQ Sucking Pig & Chicken Specialist,13.0,深水埗北河街市政大廈3樓熟食市場,$50以下,港式,熟食中心,(25 食評),216,
雲吞成麵食 Wanton Shing Noodles,7.0,深水埗元州街1號A地下,$50以下,港式,粉麵/米線,(17 食評),110,
大家食 Eat together,8.0,深水埗汝州街224號地下,$50以下,港式,粉麵/米線,(17 食評),110,
和味餐室 Delicious Cafe,,深水埗汝州街243號地下,$50以下,港式,燒臘,(21 食評),207,
梅貴緣,9.0,深水埗基隆街188號地下C號舖,$51-100,港式,素食,(23 食評),1115,
味 Delicious Cafe Restaurant,3.0,深水埗青山道9-15號富臨門大廈地下3-4號舖,$51-100,港式,漢堡包,(11 食評),101,
鵝之極品燒味專門店,3.0,深水埗元州街23號地下,$50以下,港式,燒臘,(5 食評),91,
都會冰室小廚,3.0,深水埗菴由青山道195號地下,$51-100,港式,茶餐廳/冰室,(4 食評),26,
黃金冰室 Golden Cafe,3.0,深水埗北河街134-136號銀河大廈地下B號舖,$50以下,港式,茶餐廳/冰室,(7 食評),62,
大快活 Fairwood,7.0,深水埗欽州街37號西九龍中心3樓312-314號舖,$50以下,港式,快餐店,(20 食評),51,
口福小廚,5.0,深水埗欽州街37號西九龍中心8樓美食廣場8F21號舖,$50以下,港式,粉麵/米線,(9 食評),52,
富喜飯店,4.0,深水埗荔枝角道334號地下,$51-100,港式,點心,(5 食評),81,
紅車厘麵包西餅,14.0,深水埗福榮街60號地下,$50以下,港式,麵包店,(28 食評),222,
匯發茶餐廳,7.0,深水埗元州街162-188號天悅廣場地下,$50以下,港式,茶餐廳/冰室,(12 食評),49,
湯加 Soup Plus,4.0,深水埗福華街126-128號地舖,$50以下,港式,湯品,(14 食評),214,
源興美食 Yuen Hing Food,5.0,深水埗欽州街37號西九龍中心8樓美食廣場807號舖,$50以下,港式,Food Court,(9 食評),57,
根記大排檔,2.0,深水埗醫局街94-98號地下,$50以下,港式,港式,(2 食評),246,
鍾記茶室 Chung Kee Cafe,3.0,深水埗福華街55號地下,$50以下,港式,茶餐廳/冰室,(7 食評),74,
榮華茶餐廳,5.0,深水埗福榮街58號,$50以下,港式,茶餐廳/冰室,(5 食評),126,
馬仔記粉麵餐廳,4.0,深水埗欽州街11號,$50以下,港式,粉麵/米線,(6 食評),43,
朗益燒味工房,4.0,深水埗基隆街363-365號地舖,$50以下,港式,燒臘,(11 食評),241,
全為你 Foru Handmade Cookies Ltd.,3.0,深水埗欽州街37號西九龍中心8樓60號舖,$50以下,港式,甜品/糖水,(4 食評),139,
港煮港食 Kong Kitchen,3.0,深水埗汝洲街240號地舖,$50以下,港式,茶餐廳/冰室,(4 食評),48,
星級味皇 Delicious Cafe,5.0,深水埗大埔道52號中正大廈地舖,$50以下,港式,茶餐廳/冰室,(16 食評),74,
老地方茶餐廳,3.0,深水埗福華街191-199號地下,$50以下,港式,港式,(9 食評),117,
紅火雞煲 Redfire Hotpot,5.0,深水埗順寧道23-26號康福大廈地下9號舖,$101-200,港式,雞煲,(9 食評),668,
名悅點心,2.0,深水埗汝州街25號地下,$51-100,港式,點心,(5 食評),64,
好味皇茶餐廳,9.0,深水埗福榮街5號嘉匯大廈地下,$50以下,港式,火鍋,(17 食評),289,
均香餅家,2.0,深水埗北河街205號地下,$50以下,港式,麵包店,(5 食評),1285,
明記麵家,4.0,深水埗順寧道17-25號順安閣地下1號舖,$50以下,港式,粉麵/米線,(5 食評),41,
美心西餅 Maxim's Cake Shop,7.0,深水埗港鐵深水埗站未入閘區SSP10 號舖,$50以下,港式,麵包店,(15 食評),30,
聰嫂私房甜品 Cong Sao Star Dessert,,深水埗福榮街103號地下,$50以下,港式,甜品/糖水,(20 食評),406,
新豐甜品,2.0,深水埗欽州街28號C舖,$50以下,港式,甜品/糖水,(8 食評),712,
良友冰室 Friendly Cafe,2.0,深水埗醫局街198號嘉裕居地下1及2號舖,$50以下,港式,茶餐廳/冰室,(12 食評),58,
明興牛什粉麵茶餐廳,5.0,深水埗大埔道98號地下,$50以下,港式,粉麵/米線,(10 食評),90,
標記樂園潮州粉麵餐廳 Biu Kee Lok Yuen Chiu Chau Noodles Restaurant,3.0,深水埗福華街149號地舖,$50以下,港式,粉麵/米線,(7 食評),41,
嚐味廚房 Taste Yummy Kitchen,4.0,深水埗長沙灣道145號大安樓地舖,$50以下,港式,甜品/糖水,(8 食評),68,
金豪酒家,2.0,深水埗青山道9-15號地舖,$101-200,港式,中菜館,(2 食評),93,
海港冰廳 Harbour Cafe,2.0,深水埗欽洲街56號明輝大廈地下A舖,$50以下,港式,茶餐廳/冰室,(6 食評),58,
在乎餐廳小廚,2.0,深水埗基隆街176號地舖,$51-100,港式,中菜館,(3 食評),37,
雲吞生麵食,6.0,深水埗桂林街155號,$50以下,港式,粉麵/米線,(9 食評),62,
鴻發涼茶,2.0,深水埗北河街128號地下,$50以下,港式,涼茶/龜苓膏,(2 食評),259,
椰汁大王 King of Coconut,14.0,深水埗桂林街42-44號恆誠大廈地下,$50以下,港式,台式飲品,(28 食評),234,
香辣吧,4.0,深水埗欽州街37號西九龍中心8樓美食廣場8F25號舖,$50以下,港式,港式,(7 食評),43,
豪點點心,3.0,深水埗北河街104號地舖,$51-100,港式,湯品,(6 食評),77,
乜記士多 Mc Kee Store,2.0,深水埗欽州街37號西九龍中心1樓128B鋪,$50以下,港式,小食店,(3 食評),38,
肇興雲吞麵,1.0,深水埗荔枝角道364號,$50以下,港式,粉麵/米線,(6 食評),23,
老地方果汁,3.0,深水埗長沙灣道260號秋霞樓地下,$50以下,港式,台式飲品,(3 食評),15,
Neway Karaoke Box,5.0,深水埗青山道170號宇宙商場2樓,$51-100,港式,卡拉OK,(11 食評),136,
大利冰室 Tai Lee Cafe,11.0,深水埗北河街32號,$50以下,港式,茶餐廳/冰室,(20 食評),274,
永誠冰室 Wing Shing Cafe,2.0,深水埗荔枝角道320號,$50以下,港式,茶餐廳/冰室,(12 食評),71,
心水寶茶餐廳 Shamshuipo Restaurant,2.0,深水埗長沙灣道260號秋霞樓地舖,$50以下,港式,茶餐廳/冰室,(6 食評),37,
長發餐室小廚,4.0,深水埗海壇街241-245號金海大廈地下,$50以下,港式,茶餐廳/冰室,(5 食評),37,
嘉美餅店,4.0,深水埗白楊街19號地下,$50以下,港式,麵包店,(5 食評),60,
維記咖啡,5.0,深水埗北河街市政大廈3樓熟食市場,$50以下,港式,粉麵/米線,(10 食評),209,
綠林三記甜品 Luk Lam Sam Kee Dessert,48.0,深水埗元州街9號景業大廈地下,$50以下,港式,甜品/糖水,(85 食評),363,
蝦仔記粉麵,3.0,深水埗荔枝角道348號地下,$50以下,港式,粉麵/米線,(11 食評),45,
麵站 Noodle Shop,6.0,深水埗荔枝角道322號地下,$50以下,港式,粉麵/米線,(16 食評),74,
新運通海鮮火鍋大排檔,2.0,深水埗荔枝角道299-301號地下,$51-100,港式,港式,(4 食評),53,
因·果冰室,4.0,深水埗營盤街128號地下,$51-100,港式,茶餐廳/冰室,(10 食評),75,
添記燒臘茶餐廳,3.0,深水埗北河街52號地下,$50以下,港式,燒臘,(14 食評),120,
生興麵包西餅,2.0,深水埗欽洲街7號,$50以下,港式,麵包店,(4 食評),20,
銀瑚牛扒餐廳 Ngan Wu Steak Restaurant,6.0,深水埗醫局街199號地下,$50以下,港式,港式,(11 食評),108,
名豪海鮮火鍋專門店,2.0,深水埗荔枝角道203-207號地舖,$101-200,港式,火鍋,(4 食評),83,
新滔記餐廳,3.0,深水埗北河街131號,$50以下,港式,粉麵/米線,(7 食評),72,
滿串自家醃制串燒店,,深水埗桂林街46號地下B舖,$50以下,港式,串燒,(4 食評),244,
米線站 The Mixian Station,1.0,深水埗汝州街278號地舖,$50以下,港式,粉麵/米線,(4 食評),12,
食得樂 Shek Tak Lok Fast Food,5.0,深水埗北河街124A號,$50以下,港式,港式,(7 食評),45,
櫻桃麵飽西餅 Cherry Bakery Cake Shop,2.0,深水埗基隆街262號地下,$50以下,港式,麵包店,(5 食評),79,
勁撚串,1.0,深水埗北河街33-39號地下1號舖,$51-100,港式,串燒,(1 食評),251,
味皇 Delicious Cafe,1.0,深水埗大埔道52號中正大廈地下,$50以下,港式,茶餐廳/冰室,(3 食評),45,
新記小食,4.0,深水埗長沙灣道1號E舖,$50以下,港式,小食店,(5 食評),66,
德發茶餐室,1.0,深水埗保安道325號保安道街市大樓3樓CF5號,$50以下,港式,港式,(2 食評),13,
肥仔美食,1.0,深水埗長沙灣道151號南灣大廈地下6號舖,$50以下,港式,小食店,(4 食評),12,
北河飯店,1.0,深水埗大南街275號地舖,$50以下,港式,點心,(1 食評),25,
一豆花 A1 Tofu Company,1.0,深水埗桂林街38號地下,$50以下,港式,中式糖水,(1 食評),31,
阿一豆花,1.0,深水埗桂林街38G號地下,$50以下,港式,中式糖水,(1 食評),33,
亞洲燒味叉燒大王,1.0,深水埗欽州街37號西九龍中心8樓806號舖,$50以下,港式,燒臘,(1 食評),9,
偉仔車仔麵,1.0,深水埗元州街35號地下,$50以下,車仔麵,港式,(1 食評),35,
金翠餐廳,1.0,深水埗麗閣商場地下17-18號舖,$50以下,港式,茶餐廳/冰室,(1 食評),9,
瑞生美食,1.0,深水埗深水埗營盤街美居中心48號地下,$50以下,港式,小食店,(1 食評),4,
新美麵包公司,1.0,深水埗大南街303號地舖,$50以下,港式,麵包店,(1 食評),13,
喜記粉麵茶餐廳,1.0,深水埗北河街62號地下,$50以下,港式,粉麵/米線,(1 食評),13,
包棧點心坊 Bun Fun,1.0,深水埗白楊街32號B地舖,$50以下,港式,點心,(2 食評),68,
品味台式美食,3.0,深水埗富昌邨富昌商場地下21號,$50以下,港式,粉麵/米線,(5 食評),16,
高湯點心饕 Comely Tea．Dimsum & Hob,1.0,深水埗福榮街136號地舖,$50以下,港式,點心,(2 食評),63,訂座可享小食
祺記,4.0,深水埗北河街北河街市政大廈2樓熟食中心13號舖,$50以下,港式,粥品,(7 食評),72,
皇爵麵包西餅 Dynasty Bakery,2.0,深水埗桂林街81號地下,$50以下,港式,麵包店,(3 食評),39,
譽興餐廳,3.0,深水埗荔枝角道257號地舖,$51-100,港式,串燒,(4 食評),43,
日旺果汁小食,17.0,深水埗北河街133號地下,$50以下,港式,小食店,(26 食評),149,
大家樂 Café de Coral,1.0,"深水埗大埔道188號曉尚地下2-3,5-9號地舖",$50以下,港式,快餐店,(4 食評),20,2018 Party 100美食9折
美味坊,2.0,深水埗桂林街127號地下,$50以下,港式,點心,(6 食評),28,
豪記麵家,4.0,深水埗福華街157號,$50以下,港式,港式,(10 食評),57,
芝寶堂 Chee Po Tong,1.0,深水埗欽州街50號就安大廈地下,$50以下,港式,涼茶/龜苓膏,(1 食評),6,
鄉村地道美食,,深水埗欽州街37號西九龍中心8樓美食廣場8F02號舖,$50以下,港式,茶餐廳/冰室,(3 食評),4,
醉紅豆花 JOY HOME DESSERT,,深水埗大埔道29號地下B號舖,$50以下,港式,甜品/糖水,(3 食評),52,
大快活 Fairwood,5.0,深水埗富昌邨富昌商場2樓,$50以下,港式,快餐店,(10 食評),22,
田村麵包店,5.0,深水埗大埔道150號,$50以下,港式,麵包店,(13 食評),34,
新記腸粉大皇 The King of Rice Rolls,1.0,深水埗欽州街1-9號昌遠大廈地舖,$50以下,港式,小食店,(2 食評),574,
雞煲皇火鍋(私房菜),3.0,深水埗欽州街5-7號昌遠大廈地下,$101-200,港式,火鍋,(4 食評),115,
金沙冬蔭功湯粉麵,1.0,深水埗福華街120號地下,$50以下,港式,粉麵/米線,(3 食評),65,
陳記魚蛋,15.0,深水埗欽洲街114號地舖,$50以下,港式,小食店,(42 食評),238,
海城茶餐廳,1.0,深水埗北河街33-39號地舖,$51-100,港式,海鮮,(1 食評),10,
大快活 Fairwood,1.0,深水埗海麗邨海麗商場1號舖,$50以下,港式,快餐店,(10 食評),17,
B&C 包餅美食 B & C BAKERY HOUSE,1.0,深水埗西邨路19號富昌邨富昌商場地下17號舖,$50以下,港式,麵包店,(4 食評),15,
美心西餅 Maxim's Cake Shop,1.0,深水埗欽州街37號西九龍中心地下G02號舖,$50以下,港式,麵包店,(1 食評),8,
豐麥園麵包 Honey Bakery,2.0,深水埗基隆街369號地下,$50以下,港式,麵包店,(4 食評),27,
容記茶餐廳,,深水埗桂林街38F地下,$51-100,港式,茶餐廳/冰室,(7 食評),48,
駿逸薈 Royal Club,1.0,深水埗元洲街296號西岸國際大廈2樓,$101-200,港式,會所,(1 食評),12,
大家樂 Café de Coral,3.0,深水埗長沙灣道241號桂祥大廈1樓,$50以下,港式,無肉餐單,(16 食評),44,2018 Party 100美食9折
嘉樂餅店 Ka Lok Cake Shop,1.0,深水埗荔枝角道346號,$50以下,港式,麵包店,(4 食評),39,
百寶堂,1.0,深水埗元洲街29號,$50以下,港式,涼茶/龜苓膏,(2 食評),13,
錦記車仔麵,2.0,深水埗海壇街219-221號,$50以下,車仔麵,港式,(3 食評),22,
銀濤燒味茶餐廳,,深水埗北河街159號地下,$51-100,港式,茶餐廳/冰室,(2 食評),12,
美味店,3.0,深水埗鴨寮街235號地下,$50以下,港式,小食店,(7 食評),23,
大華茶餐廳,2.0,深水埗福榮街157號冠奇大廈地下5號舖,$50以下,港式,茶餐廳/冰室,(4 食評),32,
大家食 Eat Together,19.0,深水埗福榮街84號地舖,$50以下,港式,快餐店,(46 食評),94,
樹記食品有限公司 Shu Kee Food Limited,1.0,深水埗汝州街261號地舖,$50以下,港式,外賣店,(2 食評),247,
英記粥麵店,,深水埗桂林街27-29號地舖下,$50以下,港式,粉麵/米線,(1 食評),56,
滋潤棧 Zhi Yun Shop,3.0,深水埗元洲街10號慶成大廈地下,$50以下,港式,甜品/糖水,(5 食評),30,
祥興燒臘飯店,4.0,深水埗北河街45號地下,$50以下,港式,燒臘,(5 食評),90,
小蔡茶餐廳 Siu Choi Restaurant,,深水埗石硤尾街 45 號地下,$50以下,港式,粉麵/米線,(6 食評),28,
鴻昌茶餐廳,2.0,深水埗汝州街280號地下G,$50以下,港式,港式,(6 食評),23,
東榮茶餐燒臘小菜王,,深水埗醫局街181-183號地舖,$50以下,港式,粉麵/米線,(1 食評),30,
香港餐室 Hong Kong Cafe,1.0,深水埗長沙灣道233號惠康大廈地下,$50以下,港式,茶餐廳/冰室,(5 食評),23,
小食部,2.0,深水埗欽州街114號地下,$50以下,港式,小食店,(9 食評),60,
包點料理 Boo Dim Lui Lee,4.0,深水埗基隆街256號,$50以下,港式,麵包店,(6 食評),155,
新合記茶餐廳,11.0,深水埗桂林街46號CDE舖,$50以下,港式,茶餐廳/冰室,(16 食評),41,
榮信行 Wing Shun Hong,3.0,深水埗醫局街233號地舖,$101-200,港式,大閘蟹,(3 食評),83,
鴻昌燒臘家,2.0,深水埗桂林街333號地下,$50以下,港式,燒臘,(4 食評),43,
江記海鮮菜館,1.0,深水埗醫局街161號地下,$51-100,港式,火鍋,(2 食評),76,
發記腸粉粥品,,深水埗元州街163號地下,$50以下,港式,粥品,,12,
魚蛋皇 Fish Ball King,2.0,深水埗汝洲街285號,$50以下,港式,粉麵/米線,(3 食評),307,
恒發點心 Hang Fat Dim Sum,,深水埗耀東街1號地下G舖,$50以下,港式,點心,(1 食評),33,
楊記油渣麵茶餐廳,6.0,深水埗福華街128號地下,$50以下,港式,港式,(9 食評),39,
來泰粥店,3.0,深水埗福榮街2號A店,$50以下,港式,粥品,(5 食評),76,
肥仔生滾湯飯專門店,3.0,深水埗基隆街232號地舖,$50以下,港式,港式,(4 食評),122,
琦昌茶餐廳,,深水埗北河街169號大利樓地下,$50以下,港式,茶餐廳/冰室,(5 食評),11,
偉強咖啡奶茶,2.0,深水埗界限街15號D地下,$50以下,港式,茶餐廳/冰室,(4 食評),51,
金豪粉麵飯茶餐廳,1.0,深水埗元州街25號地舖,$50以下,港式,粉麵/米線,(2 食評),23,
潮爆魚蛋 Chiu Bao Fish Ball,4.0,深水埗荔枝角道362號地下,$50以下,港式,小食店,(6 食評),136,
真味小食,1.0,深水埗北河街209號AB地下,$50以下,車仔麵,港式,(2 食評),8,
發仔記,1.0,深水埗鴨寮街101號地下,$50以下,港式,港式,(2 食評),24,
魷魚,1.0,深水埗欽州街G03號地舖,$50以下,港式,燒烤,(1 食評),14,
車仔麵包西餅,3.0,深水埗基隆街256地下,$50以下,港式,港式,(4 食評),52,
噹噹茶餐廳,,深水埗福華街208號B地下,$50以下,港式,茶餐廳/冰室,(2 食評),13,
松港小館 Pine Harbour Restaurant,2.0,深水埗基隆街298號地下,$50以下,港式,中菜館,(3 食評),22,
周師傅點心 Chau's Dim Sum,66.0,深水埗北河街131號地下,$51-100,粵菜 (廣東),點心,(78 食評),491,
祥興記上海生煎包 Cheung Hing Kee Shanghai Pan-fried Buns,30.0,深水埗欽州街96號地下,$50以下,滬菜 (上海),中式包點,(42 食評),1583,
正宗上海生煎皇后麵館,47.0,深水埗福榮街64號地舖,$51-100,滬菜 (上海),粉麵/米線,(74 食評),1218,
正宗上海生煎皇 King of Sheng Jian,30.0,深水埗福榮街100號地下,$51-100,滬菜 (上海),中菜館,(82 食評),2711,
堤諾比薩 Tino's Pizza Cafe A Handmade Italian Feast,31.0,深水埗欽州街94號黃金中心地下7-10號舖,$101-200,台灣菜,薄餅,(68 食評),1556,
馬家莊清真館 Ma's Restaurant,37.0,深水埗長沙灣道21-25號地下A舖,$51-100,新疆菜,清真認證食品,(66 食評),3271,
誠記小籠包拉麵,20.0,深水埗欽洲街58號米蘭軒地下,$51-100,滬菜 (上海),滬菜 (上海),(34 食評),901,
誠記小籠包拉麵,34.0,深水埗醫局街193號C號舖,$51-100,滬菜 (上海),滬菜 (上海),(90 食評),3004,
山東餃子館,84.0,深水埗元州街81C號舖,$50以下,鲁菜 (山東),雲吞/餃子,(159 食評),3370,
高高酒家 GoGoRestaurant,9.0,深水埗福榮街182號,$51-100,粵菜 (廣東),火鍋,(24 食評),1855,
匯發中西美食坊,17.0,深水埗福華街188號地舖,$101-200,粵菜 (廣東),茶餐廳/冰室,(19 食評),87,
譚仔三哥米線 TamJai SamGor Mixian,175.0,深水埗福榮街107號地下,$50以下,滇菜 (雲南),粉麵/米線,(325 食評),1074,
蛇王協,52.0,深水埗鴨寮街170號地下,$50以下,粵菜 (廣東),蛇羹,(79 食評),1774,
福龍門海鮮火鍋酒家,10.0,深水埗長沙灣道270號御匯大廈1樓,$101-200,粵菜 (廣東),火鍋,(17 食評),1149,
傷心酸辣粉,12.0,深水埗桂林街149號地下,$50以下,川菜 (四川),粉麵/米線,(21 食評),298,
川味美食,44.0,深水埗福榮街60號,$50以下,川菜 (四川),粉麵/米線,(83 食評),985,
龍寶酒家 Dragon Place Restaurant,23.0,深水埗元洲街280-288號地下,$51-100,粵菜 (廣東),點心,(74 食評),954,
龍運燒味火鍋茶餐廳,8.0,深水埗福華街51D號地下,$101-200,粵菜 (廣東),火鍋,(13 食評),576,
稻香 Tao Heung,11.0,深水埗大埔道222-230號快樂大廈地下及一樓全層,$101-200,粵菜 (廣東),火鍋,(29 食評),513,
雲貴坊,10.0,深水埗福華街114號地舖,$50以下,滇菜 (雲南),粉麵/米線,(13 食評),227,
四川辣妹子 Spicegirl,9.0,深水埗荔枝角道204號,$51-100,川菜 (四川),火鍋,(15 食評),770,
華記小廚,9.0,深水埗荔枝角道240-244號寶興樓地舖,$51-100,川菜 (四川),台灣菜,(15 食評),953,
新聚寶素食 Tresure Vegetarina Restaurant,11.0,深水埗大埔道79-85號民安大廈地下85號舖,$50以下,粵菜 (廣東),素食,(16 食評),460,
友記餃子 Yau Kee Dumpling,8.0,深水埗桂林街38號地下F號舖,$50以下,粵菜 (廣東),雲吞/餃子,(11 食評),479,
品蓮素食 V+ Vegetarian Restaurant,9.0,深水埗醫局街207號地下A舖,$50以下,粵菜 (廣東),素食,(14 食評),351,
蛇王業 Sher Wong Yip,18.0,深水埗南昌街139號地下,$50以下,粵菜 (廣東),湯品,(35 食評),840,
明星海鮮酒家 Star Seafood Restaurant,14.0,深水埗大埔道168-178A號地下至3樓,$101-200,粵菜 (廣東),點心,(31 食評),272,
肇順名匯河鮮專門店 Siu Shun Village Cuisine,5.0,深水埗福華街188號海峯2樓,$101-200,粵菜 (廣東),火鍋,(14 食評),296,
清玉 Kingyo,9.0,深水埗欽州街37號西九龍中心8樓美食廣場57-58號舖,$50以下,台灣菜,台式飲品,(11 食評),43,
周記油渣麵 Chow Kee Noodles,49.0,深水埗福榮街117號地下 (近桂林街),$50以下,粵菜 (廣東),粉麵/米線,(155 食評),896,
粵廚點心專門店 Canton's Dim Sum Expert,5.0,深水埗南昌街96號地下,$51-100,粵菜 (廣東),點心,(11 食評),183,
雲南小鍋米線,38.0,深水埗福榮街117號福榮大廈地下,$50以下,滇菜 (雲南),粉麵/米線,(63 食評),613,
煌府西九龍 The Palace,8.0,深水埗欽州街37號西九龍中心9樓904號舖,$101-200,粵菜 (廣東),酒樓,(25 食評),291,
江南瀨粉,4.0,深水埗福榮街108號地下,$50以下,粵菜 (廣東),粉麵/米線,(12 食評),421,
四川重口味  Heavy Taste,17.0,深水埗元州街11號地下,$51-100,川菜 (四川),粉麵/米線,(33 食評),1113,
御廚工房 Chefworks Restaurant,8.0,深水埗青山道84-90號新明閣地下5-6號舖,$51-100,粵菜 (廣東),中菜館,(15 食評),336,
寶德餐廳小廚,8.0,深水埗北河街171號地下,$50以下,粵菜 (廣東),茶餐廳/冰室,(12 食評),346,
坤記粥店 Kwan Kee,18.0,深水埗北河街56號地下 (近大南街),$50以下,粵菜 (廣東),粉麵/米線,(23 食評),369,
天譽素食 Tin Yu Vegetarian,9.0,深水埗元州街141號地舖,$51-100,粵菜 (廣東),素食,(14 食評),412,
譚仔雲南米線,3.0,"深水埗欽州街37號西九龍中心2樓215A, 216, 223-225號舖",$50以下,滇菜 (雲南),粉麵/米線,(10 食評),160,
都會冰室小廚,3.0,深水埗菴由青山道195號地下,$51-100,粵菜 (廣東),茶餐廳/冰室,(4 食評),26,
