必勝客 Pizza Hut,Unnamed: 1,薄扶林置富南區廣場2樓美食嘉年華5號舖,$101-200,意大利菜,薄餅,(4 食評),21,Unnamed: 8
Pizza-Box,7.0,薄扶林般咸道73-87號地下9號舖,$51-100,意大利菜,薄餅,(20 食評),66,
必勝客 Pizza Hut,,薄扶林置富南區廣場2樓美食嘉年華5號舖,$101-200,意大利菜,薄餅,(4 食評),21,
法式餅店 Patisserie Les Amis,3.0,薄扶林數碼港道100號數碼港商場3樓320舖,$51-100,法國菜,麵包店,(6 食評),153,
Maison Eric Kayser,,薄扶林數碼港道100號數碼港零售服務中心1樓3號舖 Fusion 內,$51-100,法國菜,麵包店,,12,
一念素食 Bijas Vegetarian Restaurant,22.0,薄扶林香港大學百周年校園逸夫教學樓地下,$50以下,西式,素食,(34 食評),1601,
意樂餐廳 Cafe de Itamomo,11.0,薄扶林華富邨華富(一)商場2D號舖,$50以下,西式,西餐廳,(28 食評),99,
Prompt,27.0,薄扶林數碼港道100號數碼港艾美酒店4樓,$401-800,西式,自助餐,(70 食評),1025,8折
星巴克咖啡 Starbucks Coffee,8.0,薄扶林香港大學綜合大樓地下2號舖,$50以下,美國菜,沙律,(14 食評),83,
Delaney's,7.0,"薄扶林數碼港道100號數碼港商場314, 411, 501及601舖",$101-200,愛爾蘭菜,酒吧,(13 食評),321,
Délifrance,6.0,薄扶林香港大學百周年校園賽馬會教學樓地下B舖,$50以下,法國菜,麵包店,(12 食評),118,
Cafe 330,5.0,薄扶林香港大學莊月明文娛中心2樓203室(百佳對面),$50以下,西式,麵包店,(11 食評),199,
PSI,5.0,薄扶林數碼港道100號數碼港艾美酒店4樓,$50以下,西式,沙律,(7 食評),100,8折
西式訓練餐廳 Western Cuisine Training Restaurant,2.0,薄扶林薄扶林道145號職業訓練局薄扶林大樓6樓,$51-100,西式,咪嘥嘢食店,(5 食評),73,
星巴克咖啡 Starbucks Coffee,25.0,薄扶林香港大學圖書館大樓舊翼,$50以下,美國菜,沙律,(48 食評),81,
麥當勞 McDonald's,6.0,薄扶林數碼港數碼港道100號 The Annex 地下1-2號舖,$50以下,美國菜,漢堡包,(11 食評),38,
星巴克咖啡 Starbucks Coffee,5.0,薄扶林數碼港三座訊科技大道4樓大堂,$50以下,美國菜,沙律,(11 食評),41,
港大山景餐廳 HKU Hill View Restaurant,1.0,薄扶林薄扶林道109號賽馬會第二舍堂村孫志新堂地舖,$50以下,西式,快餐店,(2 食評),54,
Recharge Cafe,1.0,薄扶林數碼港二座4樓,$51-100,西式,咖啡店,(1 食評),91,
Mr. Pizza,6.0,薄扶林般咸道73-83號景輝大廈地下10號舖,$51-100,意大利菜,薄餅,(10 食評),58,
Subway,2.0,薄扶林香港大學百周年校園逸夫教學樓,$50以下,西式,三文治,(3 食評),60,
太平洋咖啡 Pacific Coffee Company,,薄扶林薄扶林道香港大學太古樓地下國際交流中心,$50以下,美國菜,沙律,(3 食評),28,
麥當勞 McDonald's,4.0,薄扶林置富南區廣場4樓426-432號舖,$50以下,美國菜,漢堡包,(7 食評),18,
愛烘焙麵包工房 iBakery,,薄扶林香港大學百周年校園逸夫教學樓,$50以下,西式,麵包店,(1 食評),39,
東海堂 Arome Bakery,1.0,薄扶林置富南區廣場4樓418號舖,$50以下,西式,麵包店,(3 食評),8,
Snack Shack,1.0,薄扶林數碼港道100號數碼港商場4樓416號舖,$50以下,西式,雪糕/乳酪,(1 食評),22,
太平洋咖啡 Pacific Coffee Company,,薄扶林薄扶林道102號瑪麗醫院正座地下,$50以下,美國菜,沙律,,4,
McCafe,,薄扶林數碼港數碼港道100號 The Annex 地下1-2號舖,$50以下,美國菜,麵包店,,1,
星巴克咖啡 Starbucks Coffee,,薄扶林數碼港數碼港道100號資訊道3樓316號舖,$50以下,美國菜,沙律,,6,
快樂牛雪糕專門店 Happy Cow Ice Cream,,薄扶林香港大學綜合大樓地下2號舖,$50以下,西式,雪糕/乳酪,,72,
Eski Mo's Frozen Yogurt,,薄扶林數碼港道100號數碼港商場4樓416舖,$50以下,西式,甜品/糖水,,20,
Whirlwind Bakery,,薄扶林薄扶林道14號地下,$50以下,西式,麵包店,,4,
Stanley Ho Sports Centre Kiosk,,薄扶林沙灣徑10號何鴻燊體育中心,$50以下,西式,快餐店,,5,
Lindsay Ride Sports Centre Kiosk,,薄扶林薄扶林道111-113號賴廉士體育中心,$50以下,西式,快餐店,,2,
Mangrove Tuck Shop,,薄扶林香港大學圖書館大樓,$50以下,西式,快餐店,,7,
Pasta Di Mio,,薄扶林香港大學百周年校園賽馬會教學樓地下,$50以下,西式,快餐店,,9,
PSI,5.0,薄扶林數碼港道100號數碼港艾美酒店4樓,$50以下,多國菜,沙律,(7 食評),100,8折
Podium,1.0,薄扶林數碼港道100號數碼港艾美酒店4樓,$51-100,多國菜,酒,(1 食評),25,8折
HKU Halal Food Corner,1.0,薄扶林香港大學太古樓方樹泉文娛中心1樓,$50以下,多國菜,快餐店,(1 食評),37,
朗峰餐廳 Club Peak Wing Dining Room,,薄扶林貝沙山道58號貝沙灣朗峰會所,$101-200,多國菜,咪嘥嘢食店,,17,
灣畔餐廳 Club Bay Wing Lobby Lounge,,薄扶林貝沙灣道48號貝沙灣畔會所,$101-200,多國菜,咪嘥嘢食店,,15,
Union Restaurant,,薄扶林香港大學黃克競樓4樓,$50以下,多國菜,無肉餐單,,14,
百老匯戲院小賣部,1.0,薄扶林數碼港道100號數碼港商場地下3號舖,$50以下,港式,小食店,(1 食評),11,
原味家作 Original Taste Workshop,1.0,薄扶林數碼港數碼港道100號數碼港商場4樓403號舖,$51-100,港式,湯品,(1 食評),20,增值滿$500可獲贈$25原味家作現金劵乙張
The Pit Juice,,薄扶林數碼港道100號數碼港商場4樓美食廣場417號舖,$50以下,港式,台式飲品,(2 食評),11,
滋味坊,,薄扶林數碼港道100號數碼港商場4樓409號舖,$51-100,港式,中菜館,,4,
百樂金宴 Golden Lilies Banquet,7.0,薄扶林數碼港道100號數碼港商場102號舖,$201-400,粵菜 (廣東),酒樓,(11 食評),198,指定晚膳套餐5折；指定晚膳菜式6折
南坊 Nam Fong,17.0,薄扶林數碼港道100號數碼港艾美酒店3樓,$101-200,粵菜 (廣東),中菜館,(29 食評),507,8折
滋味坊,,薄扶林數碼港道100號數碼港商場4樓409號舖,$51-100,粵菜 (廣東),中菜館,,4,
Bar Umami,33.0,薄扶林數碼港道100號數碼港艾美酒店大堂,$101-200,日本菜,日式西餐,(49 食評),623,8折
Pepper Lunch Express,1.0,薄扶林數碼港道100號數碼港商場4樓403A舖,$51-100,日本菜,Food Court,(2 食評),63,
蓮．越泰坊,4.0,薄扶林數碼港道100號數碼港商場3樓304舖,$51-100,越南菜,泰國菜,(15 食評),95,
Dad Day Out 野餐及遊戲到會 Dad Day Out food & fun catering (非門市),,,$101-200,多國菜,網店/食品分銷,,6,
南記粉麵 Nam Kee Spring Roll Noodle Co. Ltd,35.0,香港仔香港仔大道208號地下1-3舖,$50以下,港式,粉麵/米線,(49 食評),284,
榮式燒雞扒 Wing's Cuisine,12.0,香港仔舊大街58-62號地下1-2舖,$50以下,港式,茶餐廳/冰室,(24 食評),321,
魚米 Yu Mai,8.0,香港仔湖北街16號地舖,$50以下,港式,粉麵/米線,(22 食評),141,
艇仔粉,11.0,香港仔香港仔海傍公園,$50以下,港式,粉麵/米線,(16 食評),1051,
覓廚 Mix n Match,7.0,香港仔香港仔大道120號百匯行11樓,$51-100,港式,拉麵,(12 食評),206,
周記茶餐廳,20.0,香港仔香港仔大道154號,$50以下,港式,茶餐廳/冰室,(29 食評),597,
大佳B甜品屋,37.0,香港仔舊大街120號兆群大廈地下3號舖,$50以下,港式,甜品/糖水,(63 食評),392,
潮苑正宗潮洲粉麵 Chiu Yuen Chiu Chow Noodle,24.0,香港仔湖北街12號地下,$50以下,港式,粉麵/米線,(58 食評),236,
金門餐廳 Golden Gate Restaurant,29.0,香港仔西安街2-3號,$50以下,港式,麵包店,(63 食評),308,
滿記甜品 Honeymoon Dessert,5.0,香港仔南寧街ac5地下5號舖,$50以下,港式,甜品/糖水,(13 食評),72,
拱照車仔麵,8.0,香港仔香港仔大道196號地舖,$50以下,車仔麵,港式,(24 食評),143,
富嘉食堂 FullGar Canteen,6.0,香港仔香港仔大道 234 號富嘉工業大廈 401-402室,$101-200,港式,粉麵/米線,(9 食評),287,
功夫點心 Kung Fu Dim Sum,6.0,"香港仔香港仔大道190號地下A, B & C舖",$50以下,港式,點心,(20 食評),143,
麗絲快餐店,8.0,香港仔華富（二）邨商場6樓17-18號舖,$50以下,港式,快餐店,(10 食評),113,
翠華餐廳 Tsui Wah Restaurant,29.0,香港仔香港仔舊大街108-116號地下,$51-100,港式,無肉餐單,(58 食評),217,
南記粉麵 Nam Kee Spring Roll Noodle Co. Ltd,5.0,香港仔東勝道10號朗盈商業大廈1樓及2樓,$50以下,港式,粉麵/米線,(12 食評),83,
永康甜品店 Wing Hong Dessert,10.0,香港仔香港仔大道171號金豐大廈地下K-L舖(東勝道入),$50以下,港式,甜品/糖水,(19 食評),122,
成記牛什粉麵,4.0,香港仔香港仔大道203號香港仔市政大廈2樓熟食中心10號舖,$50以下,港式,粉麵/米線,(5 食評),47,
漁米鎮菜館,8.0,香港仔舊大街80-82號地下,$51-100,港式,茶餐廳/冰室,(17 食評),314,
湯加 Soup Plus,,香港仔湖北街22號地舖,$50以下,港式,湯品,(12 食評),94,
香港仔魚市場二合海鮮餐廳 Aberdeen Fish Market Yee Hope Seafood Restaurant,8.0,香港仔香港仔石排灣道102號香港仔魚類批發市場,$101-200,港式,海鮮,(15 食評),1009,
豐盛餃子園,2.0,香港仔石排灣道90號四喜大廈地下,$50以下,港式,雲吞/餃子,(4 食評),73,
樂粥本,2.0,香港仔香港仔大道181號地舖,$50以下,港式,港式,(6 食評),67,
餃子達人 Dumpling Hero,1.0,香港仔華貴道3號華貴坊20號舖,$50以下,港式,雲吞/餃子,(3 食評),33,
殿糖級,5.0,香港仔南寧街ac4 1樓1號舖,$50以下,港式,甜品/糖水,(10 食評),57,
華富冰室 Wah Fu Cafe,3.0,香港仔華富邨商場1期地下,$50以下,港式,茶餐廳/冰室,(15 食評),97,
合利粥品店,2.0,香港仔東勝道21號地舖,$50以下,港式,粥品,(6 食評),57,
包點達人 Bao Dim Tat Yan,2.0,香港仔華貴道3號華貴坊地下12號舖,$50以下,港式,中式包點,(2 食評),21,
銀都冰室 Silver Cafe,19.0,香港仔華富村華光樓707-708號,$50以下,港式,茶餐廳/冰室,(42 食評),335,
美心西餅 Maxim's Cake Shop,14.0,香港仔成都道38號利港中心23及24號舖,$50以下,港式,麵包店,(24 食評),40,
大記糕點 Dai Kee,1.0,香港仔香港仔大道223號利群商業大廈地下33號舖,$50以下,港式,甜品/糖水,(2 食評),94,
同和粥麵,3.0,香港仔湖北街海波大樓地下,$50以下,港式,粥品,(10 食評),73,
大家樂 Café de Coral,3.0,香港仔石排灣商場1號舖,$50以下,港式,無肉餐單,(6 食評),20,2018 Party 100美食9折
華聯,4.0,香港仔華富邨商場36號舖,$50以下,車仔麵,港式,(9 食評),50,
拱照車仔麵,8.0,香港仔東勝道31號C地舖,$50以下,車仔麵,港式,(23 食評),90,
湯加 Soup Plus,1.0,香港仔華貴道3號華貴坊地下30號舖,$50以下,港式,湯品,(2 食評),16,
大快活 Fairwood,5.0,"香港仔南寧街ac2 地下18, 20-24及26號舖",$50以下,港式,快餐店,(13 食評),29,
永發車仔麵茶餐廳,2.0,香港仔香港仔大道136號地舖,$50以下,車仔麵,港式,(5 食評),43,
炳記麵家 Ping Kee Restaurant,1.0,香港仔田灣嘉禾街21-25號永穩大廈地下D號舖,$50以下,港式,粉麵/米線,(1 食評),32,
美食獵人,3.0,香港仔奉天街1號,$50以下,港式,港式,(6 食評),23,
泰昌餅家 Tai Cheong Bakery,9.0,香港仔湖北街12號裕景中心地下4-5號舖,$50以下,港式,麵包店,(15 食評),65,
好運點心專門店,3.0,香港仔石排灣道80號地下A舖,$51-100,港式,點心,(6 食評),82,
田苑珍姐美食餐廳 Tin Yuen Chuw Che Nice Food Restaurant,14.0,香港仔田灣石排灣道80號地下D舖,$50以下,港式,茶餐廳/冰室,(25 食評),140,
鏗記美食餐廳小廚,2.0,香港仔華富邨商場34號舖,$50以下,港式,茶餐廳/冰室,(4 食評),44,
華富閣茶餐廳,1.0,香港仔華富邨華樂徑4號,$50以下,港式,茶餐廳/冰室,(1 食評),20,
大快活 Fairwood,,香港仔華富邨華富商場2C號舖,$50以下,港式,快餐店,(2 食評),11,
靠得住粥麵小館 Trusty Congee King,2.0,香港仔南寧街6-12號香港仔中心4期1樓14號舖,$51-100,港式,粉麵/米線,(5 食評),44,
家家烘焙,1.0,香港仔石排灣道71-73號建安樓地下A舖,$50以下,港式,麵包店,(1 食評),9,
文記咖啡,2.0,香港仔漁光道熟食街市5樓,$50以下,港式,大牌檔,(3 食評),43,
雄記茶餐廳,2.0,香港仔舊大街118-120號兆群大廈地下7號舖,$50以下,港式,茶餐廳/冰室,(5 食評),39,
滋味靚湯 FLASOUP,1.0,香港仔香港仔大道234號富嘉工業大廈22樓06室,$50以下,港式,甜品/糖水,(1 食評),37,
自在軒 Take a Break,9.0,香港仔香港仔大道203號香港仔市政大廈5樓,$50以下,港式,快餐店,(12 食評),113,
烽築 Fung Chuk,,香港仔湖北街12號裕景中心地下7號舖,$50以下,港式,小食店,(3 食評),14,
MX,2.0,香港仔成都道20-28號添喜大廈1樓3號,$50以下,港式,快餐店,(4 食評),12,
唐記包點 Tong Kee Bao Dim,,香港仔西安街5號地下5B號舖,$50以下,港式,點心,(1 食評),26,
奇華餅家 Kee Wah Bakery,2.0,香港仔成都道38號利港中心地下,$50以下,港式,麵包店,(4 食評),9,
阿波羅 Appolo,1.0,香港仔華富邨一期商場21號舖,$50以下,港式,雪糕/乳酪,(2 食評),8,9折
超羣麵包西餅 Maria's Bakery,,香港仔華貴道3號華貴坊地下7號舖,$50以下,港式,麵包店,(2 食評),14,憑信用卡惠顧8吋以上小公主系列蛋糕，可享8折優惠
百味園 Click Park,1.0,香港仔田灣街11號地下2號舖,$50以下,港式,茶餐廳/冰室,(3 食評),26,
一哥湯麵皇館,10.0,香港仔利群商場地下2號舖,$50以下,港式,港式,(13 食評),213,
美心西餅 Maxim's Cake Shop,2.0,香港仔華富村商場19號舖,$50以下,港式,麵包店,(6 食評),11,
總部美食屋 Headquarters,3.0,香港仔嘉禾街14-20號嘉和大廈3B舖,$50以下,港式,港式,(6 食評),21,
大家樂 Café de Coral,,香港仔華貴邨華貴商場地下26號舖,$50以下,港式,快餐店,(3 食評),4,
津津美食,1.0,香港仔西安街5號地下D舖,$50以下,港式,小食店,(1 食評),12,
樂富小食,2.0,香港仔田灣嘉禾街1-3號地下F舖,$50以下,港式,快餐店,(3 食評),10,
煮餸易 CookEasy,1.0,香港仔惠福道4號賽馬會復康中心D座308室,$50以下,港式,社企餐廳,(1 食評),35,
億榮粉麵餐廳小廚 Yik Wing Noodles Restaurant,1.0,香港仔華富邨商場35號舖,$50以下,港式,粉麵/米線,(1 食評),24,
康姨餅房 Madam Hong's Bakery,1.0,香港仔漁光道85號扶康會康復中心西翼4樓,$50以下,港式,麵包店,(1 食評),4,
豐記 Fung Kee,1.0,香港仔漁光道街市 5 樓 2 號舖,$50以下,港式,外賣店,(1 食評),18,
弟記燒臘茶餐廳,2.0,香港仔田灣街5號地下,$50以下,港式,燒臘,(3 食評),21,
祥興咖啡,1.0,香港仔香港仔大道203號香港仔市政大廈2樓熟食中心,$50以下,港式,茶餐廳/冰室,(1 食評),13,
豪苑粉麵,1.0,香港仔田灣嘉禾街22號,$50以下,港式,粉麵/米線,(1 食評),4,
耀記咖啡,1.0,香港仔香港仔大道203號香港仔市政大廈2樓熟食中心CF2舖,$50以下,港式,熟食中心,(2 食評),13,
得記燒臘飯店,1.0,香港仔東勝道13號地下,$50以下,港式,燒臘,(5 食評),24,
得園,1.0,香港仔漁光道熟食街市5樓,$50以下,港式,粥品,(2 食評),9,
英姐茶餐廳,,香港仔田灣嘉禾街14-22號地下4A舖,$50以下,港式,粉麵/米線,(1 食評),11,
榮記快餐店 Win's fast food shop,2.0,香港仔香港仔大道8號景惠花園地下7號舖,$50以下,港式,快餐店,(3 食評),14,
明輝中西美食,2.0,香港仔香港仔大道70號地下,$50以下,港式,咪嘥嘢食店,(2 食評),15,
釗記茶餐廳  Chiu Kee Restaurant,3.0,香港仔香港仔大道134號地下,$50以下,港式,茶餐廳/冰室,(7 食評),19,
匯海食家,1.0,香港仔田灣嘉禾街1-3號地下B舖,$50以下,港式,茶餐廳/冰室,(1 食評),8,
祥記,,香港仔漁光道街市12號舖,$51-100,港式,大牌檔,(3 食評),10,
聖安娜餅屋 Saint Honore Cake Shop,6.0,香港仔東勝道21號地下,$50以下,港式,麵包店,(11 食評),11,
榮華餅家 Wing Wah,2.0,香港仔成都道4號,$50以下,港式,麵包店,(3 食評),5,
健生,2.0,香港仔湖南街6B舖,$50以下,港式,涼茶/龜苓膏,(2 食評),3,
翠河餐廳 Green River Restaurant,3.0,香港仔香港大道128號金香大廈地舖,$51-100,港式,茶餐廳/冰室,(7 食評),31,
大快樂餐廳,6.0,香港仔瀑布灣道2號華富商場,$50以下,港式,茶餐廳/冰室,(10 食評),32,
好運鵝煲火鍋小炒王,1.0,香港仔田灣嘉禾街14號地下A1舖,$101-200,港式,火鍋,(1 食評),14,
田灣冰室,,香港仔田灣嘉禾街27-33號大德樓地下E舖,$51-100,港式,雞煲,,14,
添添素食,,香港仔東勝道31號地下D-E號舖,$50以下,港式,素食,(1 食評),17,
太興 Tai Hing,2.0,香港仔南寧街6-12號香港仔中心4期1樓14號舖,$51-100,港式,燒臘,(4 食評),23,
嘉豪酒家 Ka Ho Restaurant,9.0,香港仔華富村商場10號舖,$101-200,港式,酒樓,(19 食評),54,
潮發記,,香港仔東勝道3號地舖,$50以下,港式,粉麵/米線,,3,
熱賣點 Hot Shot,,香港仔香港仔大道178號地舖,$50以下,港式,小食店,,0,
熱賣點 Hot Shot,,香港仔南寧街7-11號香港仔中心2期25號地舖,$50以下,港式,小食店,,0,
熱賣點 Hot Shot,,香港仔田灣村田灣商場102號舖,$50以下,港式,小食店,,0,
熱賣點 Hot Shot,,香港仔鴨脷洲村多層停車場地下6號舖,$50以下,港式,小食店,,0,
OK便利店 Hot & In 美食吧 Circle K Hot & In Steam Station,,香港仔華富村華安樓116號舖,$50以下,港式,小食店,,0,
OK便利店 Hot & In 美食吧 Circle K Hot & In Steam Station,,香港仔南寧街13-23號香港仔中心第五期地下7號舖,$50以下,港式,小食店,,0,
熱賣點 Hot Shot,,香港仔華富邨二期商場地下S24A號舖,$50以下,港式,小食店,,3,
皆為食 All About Food,,香港仔田灣石排灣道81號兆暉大廈地下7號舖,$50以下,港式,港式,,10,
明華海鮮,,香港仔香港仔大道203號香港仔市政大厦地庫23號舖,$101-200,港式,海鮮,,4,
源歡,,香港仔華富（二）邨商場5樓43號舖,$50以下,港式,中式糖水,,4,
731冰室,,香港仔田灣嘉禾街27-33號地舖,$51-100,港式,茶餐廳/冰室,,9,
鑑記車仔麵,,香港仔華富道15號華富邨華安樓地下112號舖,$50以下,車仔麵,港式,,9,
美雅餅店,,香港仔田灣街2號地下B舖,$50以下,港式,麵包店,,3,
好運粥粉麵家,,香港仔嘉禾街22號地舖,$50以下,港式,雲吞/餃子,,6,
祥發茶餐廳,,香港仔嘉禾街14-22號嘉和大廈A座地下4A號舖,$50以下,港式,茶餐廳/冰室,,5,
孖寶美食記,,香港仔西安街5號D,$50以下,港式,小食店,,6,
美心西餅 Maxim's Cake Shop,,香港仔港鐵海洋公園站2號舖,$50以下,港式,麵包店,(1 食評),8,
有記粉麵廠 Yau Kee Noodles,,香港仔香港仔大道171號金豐大廈地下N號舖,$50以下,港式,粉麵/米線,,34,
凱施餅店 Hoixe Cake Shop,,香港仔東勝道17號地舖,$50以下,港式,麵包店,,8,
英記飯店,,香港仔田灣興和街11號田灣街市熟食中心2樓7-8號舖,$51-100,港式,粵菜 (廣東),,7,
肥常餐廳,,香港仔嘉禾街13號地舖,$50以下,港式,快餐店,,32,
蘇記茶檔,,香港仔深灣珍寶王國4樓,$50以下,港式,粉麵/米線,,8,
太興 Tai Hing (已搬遷),17.0,香港仔南寧街6-12號香港仔中心第5期地下A號舖,$51-100,港式,燒臘,(43 食評),118,
永發外賣快餐店 (已搬遷),2.0,香港仔華貴村華貴街市5號,$50以下,車仔麵,港式,(2 食評),6,
炳記麵家 Ping kee restaurant (已搬遷),4.0,香港仔田灣街1號地下,$50以下,港式,粉麵/米線,(5 食評),13,
茶木‧台式休閒餐廳 TeaWood Taiwanese Cafe & Restaurant,14.0,香港仔南寧街ac5 1樓E號舖,$51-100,台灣菜,甜品/糖水,(46 食評),283,
富臨皇宮 Fulum Palace,10.0,香港仔南寧街ac3 1樓,$101-200,粵菜 (廣東),點心,(13 食評),147,
上海天龍樓,30.0,香港仔舊大街58-62號C舖,$51-100,滬菜 (上海),中菜館,(52 食評),855,
譚仔雲南米線,9.0,香港仔成都道38號利港中心2樓208號舖,$50以下,滇菜 (雲南),粉麵/米線,(20 食評),186,
八方雲集鍋貼水餃專門店 Bafang Dumpling,10.0,香港仔南寧街ac5地下2號舖,$50以下,台灣菜,雲吞/餃子,(15 食評),113,
天仁茗茶 TenRen's Tea,6.0,香港仔南寧街ac4地下2A舖,$50以下,台灣菜,台式飲品,(7 食評),99,
華記小廚 Wah Kee Restaurant,3.0,香港仔香港仔舊大街82號地舖,$51-100,粵菜 (廣東),川菜 (四川),(3 食評),77,
新昌發正宗潮州粉麵,7.0,香港仔東勝道15號地下,$50以下,潮州菜,粉麵/米線,(13 食評),92,
百味王火鍋酒家 Best Hotpot Restaurant,5.0,香港仔南寧街ac2地下1及28號舖,$101-200,粵菜 (廣東),火鍋,(11 食評),176,
百樂門宴會廳 Paramount Banquet Hall,21.0,香港仔南寧街ac5 1樓F舖,$101-200,粵菜 (廣東),點心,(44 食評),363,
香港仔魚市場二合海鮮餐廳 Aberdeen Fish Market Yee Hope Seafood Restaurant,8.0,香港仔香港仔石排灣道102號香港仔魚類批發市場,$101-200,粵菜 (廣東),海鮮,(15 食評),1009,
綠野仙踪 Greenland Corner,7.0,香港仔祟文街15-17號華利大廈LG1地庫,$51-100,台灣菜,台灣菜,(17 食評),171,
新光酒樓 Hsin Kwong Restaurant,11.0,香港仔南寧街ac3 2樓,$101-200,粵菜 (廣東),點心,(27 食評),133,
稻香 Tao Heung,1.0,香港仔成都道38號利港商場3樓302號舖,$101-200,粵菜 (廣東),火鍋,(8 食評),118,
九記,4.0,香港仔香港仔大道203號香港仔市政大廈2樓熟食中心7號舖,$50以下,粵菜 (廣東),粵菜 (廣東),(4 食評),122,
海東軒,1.0,香港仔香港仔大道152-156號宏興大廈地下C&E號舖及1樓全層,$101-200,粵菜 (廣東),中菜館,(2 食評),148,
譚仔三哥米線 TamJai SamGor Mixian,2.0,香港仔香港仔中心5期地下3號舖,$50以下,滇菜 (雲南),粉麵/米線,(11 食評),141,
喜起海鮮小炒 Hei Hei seafood restaurant,1.0,香港仔田灣石排灣道80號南景花園地下D舖,$101-200,粵菜 (廣東),中菜館,(5 食評),145,
寶寶餐廳小廚,1.0,香港仔黃竹坑深灣道2號包玉剛游泳池,$51-100,粵菜 (廣東),中菜館,(2 食評),21,
英記勝哥 Ying Kee,3.0,香港仔香港仔大道203號香港仔市政大廈2樓熟食中心3號舖,$50以下,粵菜 (廣東),粵菜 (廣東),(5 食評),92,
湘粵味餐廳,1.0,香港仔田灣嘉和街14-22號嘉和大廈A座地下5號舖,$51-100,粵菜 (廣東),湘菜 (湖南),(3 食評),20,
海天閣 The Horizon,2.0,香港仔深灣道8號香港深灣遊艇會9樓,$101-200,粵菜 (廣東),會所,(2 食評),71,
鴻福堂 Hung Fook Tong,1.0,香港仔湖南街1-3號安泰大廈地下C號舖,$50以下,粵菜 (廣東),涼茶/龜苓膏,(2 食評),8,
肇順名匯河鮮專門店 Siu Shun Village Cuisine,,香港仔南寧街ac5 1樓F舖,$101-200,粵菜 (廣東),酒樓,(1 食評),49,
潮苑餐廳,8.0,香港仔東勝道地下,$50以下,潮州菜,潮州菜,(22 食評),56,
明都餐廳 Uptown 88,3.0,香港仔石排灣道88地下,$50以下,粵菜 (廣東),火鍋,(5 食評),43,
方記菜館 Fong Kee Restaurant,1.0,香港仔田灣漁歌街 5 號碧麗大廈 G24-25 地舖,$50以下,粵菜 (廣東),燒臘,(2 食評),36,
潮興滷味專門店,1.0,香港仔東勝道8號地舖,$50以下,潮州菜,燒臘,(2 食評),11,
譽港酒家,1.0,香港仔華貴道3號華貴坊1樓,$101-200,粵菜 (廣東),點心,(3 食評),31,
百樂門囍宴 Joy Cuisine,4.0,"香港仔南寧街ac2 1樓1, 3及5-8號舖",$101-200,粵菜 (廣東),點心,(7 食評),134,
華園華昌燒臘,2.0,香港仔田灣嘉禾街1-3號地下E舖,$50以下,外賣店,粵菜 (廣東),(3 食評),11,
好運鵝煲火鍋小炒王,1.0,香港仔田灣嘉禾街14號地下A1舖,$101-200,粵菜 (廣東),火鍋,(1 食評),14,
添添素食,,香港仔東勝道31號地下D-E號舖,$50以下,粵菜 (廣東),素食,(1 食評),17,
歇腳亭 Sharetea,1.0,香港仔成都道20-28號添喜大廈地舖,$50以下,台灣菜,台式飲品,(1 食評),23,
嘉豪酒家 Ka Ho Restaurant,9.0,香港仔華富村商場10號舖,$101-200,粵菜 (廣東),酒樓,(19 食評),54,
容記小菜王,1.0,香港仔香港仔大道128號金香大廈地舖,$101-200,粵菜 (廣東),中菜館,(1 食評),8,
The Horizon,,香港仔深灣道8號深灣遊艇會,$101-200,粵菜 (廣東),中菜館,,1,
貢茶 Gong Cha,,香港仔東勝道10號朗盈商業大廈地下B號舖,$50以下,台灣菜,台式飲品,,1,
明華海鮮,,香港仔香港仔大道203號香港仔市政大厦地庫23號舖,$101-200,粵菜 (廣東),海鮮,,4,
鴻福堂 Hung Fook Tong,,香港仔港鐵海洋公園站OCP 1號舖,$50以下,粵菜 (廣東),涼茶/龜苓膏,(1 食評),3,
盞記 First Edible Nest,,香港仔東勝道4號地下,$101-200,粵菜 (廣東),甜品/糖水,,3,
英記飯店,,香港仔田灣興和街11號田灣街市熟食中心2樓7-8號舖,$51-100,粵菜 (廣東),港式,,7,
厚興瑜記手撕雞,,香港仔香港仔大道208號裕輝商業中心地下4號舖,$50以下,粵菜 (廣東),粵菜 (廣東),,20,
華記小廚 Wah Kee Restaurant (已搬遷),4.0,香港仔香港仔舊大街56號地舖,$51-100,川菜 (四川),台灣菜,(13 食評),194,
華記小廚 Wah Kee Restaurant (已搬遷),8.0,香港仔湖南街9號地下,$51-100,川菜 (四川),台灣菜,(9 食評),106,
群心茶餐廳 Kwan Sham Restaurant (已搬遷),,香港仔香港仔大道134號地下,$50以下,粵菜 (廣東),粉麵/米線,(5 食評),23,
群心餐廳 Kwan Sham Restaurant (已搬遷),4.0,香港仔田灣石排灣道 85 號地下,$50以下,粵菜 (廣東),粉麵/米線,(6 食評),62,
粗菜館 Tso Choi (已搬遷),2.0,香港仔舊大街56號地舖,$101-200,粵菜 (廣東),中菜館,(4 食評),26,
南小館 The Dining Room (裝修中),,香港仔南寧街6-12號香港仔中心(第五期)地下A舖,$101-200,滬菜 (上海),點心,,5,
湘粵味餐廳,1.0,香港仔田灣嘉和街14-22號嘉和大廈A座地下5號舖,$51-100,粵菜 (廣東),茶餐廳/冰室,(3 食評),20,
華記小廚 Wah Kee Restaurant (已搬遷),4.0,香港仔香港仔舊大街56號地舖,$51-100,台灣菜,火鍋,(13 食評),194,
