重慶老巷,8.0,大角咀福全街12-16號福全大廈地舖,$51-100,川菜 (四川),中菜館,(20 食評),577,
上海包餃店,20.0,大角咀晏架街12A號地下,$50以下,滬菜 (上海),外賣店,(35 食評),584,
駿發食館,6.0,大角咀洋松街20-24號地下,$51-100,粵菜 (廣東),火鍋,(12 食評),283,
豐碩 Harvest Seafood Restaurant,8.0,大角咀埃華街8號奥朗御峰1樓101號舖,$101-200,粵菜 (廣東),火鍋,(13 食評),360,
譚仔三哥米線 TamJai SamGor Mixian,4.0,大角咀海庭道18號奧海城二期地下G71A&G71B號舖,$50以下,滇菜 (雲南),粉麵/米線,(7 食評),406,
譽小館 Praise Dining Bristro,4.0,大角咀海庭道18號奧海城二期1樓103號,$51-100,粵菜 (廣東),火鍋,(14 食評),247,
金寶小廚 Kam Bo Restaurant,9.0,大角咀博學里1-13號富多來新邨1期地下60號舖,$51-100,粵菜 (廣東),茶餐廳/冰室,(11 食評),109,
晶輝飯店,18.0,大角咀角祥街31-33號地下,$50以下,粵菜 (廣東),雞煲,(27 食評),890,
名苑酒家 Ming Garden Restaurant,5.0,大角咀海輝道18號一號銀海地下,$101-200,粵菜 (廣東),點心,(16 食評),540,
沾仔記,6.0,大角咀埃華街11號地下,$50以下,粵菜 (廣東),粉麵/米線,(9 食評),369,
天廚慈航齋素,4.0,大角咀杉樹街2-16號金基大廈1-2號鋪,$51-100,粵菜 (廣東),川菜 (四川),(6 食評),242,
鄰家湯 Tom Soup,3.0,大角咀博文街7號地舖,$51-100,外賣店,粵菜 (廣東),(3 食評),125,
川品雲南米線,4.0,大角咀晏架街77號富多來商場二期地下6號舖,$50以下,滇菜 (雲南),川菜 (四川),(6 食評),101,
三和滋味館,2.0,大角咀大全街38號地舖,$51-100,滬菜 (上海),雲吞/餃子,(4 食評),53,
彩翠軒酒家,3.0,大角咀櫸樹街88號奧柏御峰1樓,$101-200,粵菜 (廣東),酒樓,(10 食評),155,
尚御潮滷居 Noble Imperial,3.0,大角咀杉樹街2-16號金基大廈地下5號舖,$51-100,中菜館,潮州菜,(5 食評),265,
煌極 Mighty Taste Cuisine,2.0,大角咀大全街54號大同新邨大滿樓地下4B號舖,$201-400,粵菜 (廣東),川菜 (四川),(6 食評),251,
譚仔雲南米線,2.0,大角咀海富苑海富商場地下8-9號舖,$50以下,滇菜 (雲南),粉麵/米線,(2 食評),38,
夠彊美食,19.0,大角咀中匯街30A地下,$50以下,新疆菜,串燒,(27 食評),683,
玲瓏小鎮,6.0,大角咀富榮花園46號地下,$50以下,川菜 (四川),粉麵/米線,(8 食評),113,
許願樹美食,2.0,大角咀中滙街8號中和樓地下9號舖,$50以下,粵菜 (廣東),串燒,(4 食評),80,
沾仔記麵食 Tsim Chai Noodle,14.0,大角咀中匯街40號地下,$50以下,粵菜 (廣東),粉麵/米線,(30 食評),233,
正宗雲貴川 Zheng Zong Yun Gui Chuan,,大角咀中匯街4號,$50以下,川菜 (四川),粉麵/米線,(26 食評),191,
興發小廚,2.0,大角咀橡樹街95號地舖,$51-100,粵菜 (廣東),中菜館,(3 食評),109,
鴻福堂 Hung Fook Tong,1.0,大角咀海泓道1號奧海城三期UG樓UG101舖,$50以下,粵菜 (廣東),涼茶/龜苓膏,(1 食評),11,
味川雲南小館,2.0,大角咀詩歌舞街83號亮賢居地下12號舖,$51-100,滇菜 (雲南),川菜 (四川),(2 食評),19,
雲桂香米線專門店,3.0,大角咀埃華街56號地下,$50以下,滇菜 (雲南),桂菜 (廣西),(12 食評),115,
盈豐擔擔麵,1.0,大角咀櫻桃街24號3B號舖,$50以下,京川滬,雲吞/餃子,(3 食評),79,
星仔記美食,1.0,大角咀鐵樹街50號富多來商場第二期地下95號舖,$50以下,粵菜 (廣東),快餐店,(1 食評),40,
仙桃島 Fairy Farm,7.0,大角咀福利街8號港灣豪庭廣場G09地下,$50以下,台灣菜,台灣菜,(19 食評),129,
鴻福堂 Hung Fook Tong,2.0,大角咀港鐵奧運站G3號舖,$50以下,粵菜 (廣東),涼茶/龜苓膏,(3 食評),24,
麗宮薈 Palace Club,1.0,大角咀福利街8號港灣豪庭廣場1樓126號舖,$101-200,粵菜 (廣東),火鍋,(5 食評),67,
譚仔三哥米線 TamJai SamGor Mixian,22.0,大角咀大全街28號大同新村大貴樓地下,$50以下,滇菜 (雲南),粉麵/米線,(45 食評),201,
善膳軒 Food for all Kitchen,2.0,大角咀通州街28號頌賢花園地下商場4號,$50以下,粵菜 (廣東),快餐店,(5 食評),40,
八方雲集鍋貼水餃專門店 Bafang Dumpling,1.0,大角咀新九龍廣場地下G30舖,$50以下,台灣菜,雲吞/餃子,(3 食評),30,
巴蜀麻辣米線,,大角咀中匯街52號地下,$50以下,川菜 (四川),粉麵/米線,(1 食評),38,
鵝皇館,,大角咀大角咀道97-105號大同新邨大方樓地下,$201-400,粵菜 (廣東),粵菜 (廣東),(1 食評),19,
潮味館,,大角咀櫸樹街20號富多來商場地舖,$50以下,潮州菜,粵菜 (廣東),,8,
利源海南雞小廚 LAIYUEN,,大角咀海庭道8號富榮花園地下7號鋪,$50以下,粵菜 (廣東),車仔麵,,15,
鼎旺 Sino Recipe,4.0,大角咀塘尾道51號地下B及C舖,$51-100,粵菜 (廣東),中菜館,(10 食評),48,
品臻 Ban Chun,,大角咀海庭道8號16號地舖,$51-100,台灣菜,台灣菜,,0,
貢茶 Gong Cha,,大角咀新九龍廣場地下27號舖,$50以下,台灣菜,台式飲品,,14,
上海么鳳,,大角咀海輝道11號奧海城一期UG樓UG03號舖,$50以下,滬菜 (上海),滬菜 (上海),(1 食評),21,
八方雲集鍋貼水餃專門店 Bafang Dumpling,,大角咀海庭道18號奧海城二期1樓大食代,$50以下,台灣菜,雲吞/餃子,(2 食評),43,
姐妹麻辣美食小天地,,大角咀樂群街2A-2B號中美樓地舖,$50以下,川菜 (四川),茶餐廳/冰室,,14,
海天堂 Hoi Tin Tong,,大角咀大角咀道171號地下4及5號舖,$50以下,粵菜 (廣東),涼茶/龜苓膏,,10,
鴻福堂 Hung Fook Tong,,大角咀大角咀道38號新九龍廣場地下17號舖,$50以下,粵菜 (廣東),涼茶/龜苓膏,,1,
巴蜀麻辣米綫 (已搬遷),31.0,大角咀埃華街95號,$50以下,川菜 (四川),粉麵/米線,(46 食評),557,
麥記膳房 Mak's Kitchen (已搬遷),2.0,大角咀九龍大角咀利得街10至12號地下,$51-100,粵菜 (廣東),中菜館,(7 食評),391,
蛇王濤蛇店 Se Wong To (已搬遷),26.0,大角咀埃華街1號地下,$51-100,粵菜 (廣東),中菜館,(45 食評),129,
鍋沁小廚 (已搬遷),2.0,大角咀大角咀杉樹街9號地下,$101-200,川菜 (四川),中菜館,(2 食評),34,
興城風味麻辣米線 Hing Sing Spicy Noodles (已搬遷),10.0,大角咀海庭道8號富榮花園地下8號舖,$50以下,川菜 (四川),粉麵/米線,(14 食評),22,
鄰家湯 Tom Soup (已搬遷),,大角咀大角咀道33號地舖,$51-100,外賣店,粵菜 (廣東),,33,
天廚慈航齋素,4.0,大角咀杉樹街2-16號金基大廈1-2號鋪,$51-100,粵菜 (廣東),素食,(6 食評),242,
煌極 Mighty Taste Cuisine,2.0,大角咀大全街54號大同新邨大滿樓地下4B號舖,$201-400,粵菜 (廣東),火鍋,(6 食評),251,
玥屋,33.0,大角咀海景街44號地舖,$101-200,日本菜,壽司/刺身,(45 食評),8412,
牛角日本燒肉專門店 Gyu-Kaku,23.0,大角咀海庭道18號奧海城二期1樓128A號舖,$201-400,日本菜,烤肉,(41 食評),1559,
灃水產和風料理,32.0,大角咀中匯街61號中星樓地下5號舖,$201-400,日本菜,烤肉,(35 食評),770,
宗像牛肉屋 Munakata Beef House,19.0,大角咀利得街52號地下,$101-200,日本菜,日本菜,(35 食評),5128,
武館 BUKAN Japanese Restaurant,36.0,大角咀利得街46號地舖,$801以上,日本菜,壽司/刺身,(40 食評),1177,送 25里數 / 30積分
小林札幌拉麵 Kobayashi Sapporo Ramen,22.0,大角咀博文街11號富貴大廈西座地下16號舖,$101-200,日本菜,拉麵,(34 食評),541,
月島 Tsuki,29.0,大角咀大全街22號地舖,$101-200,日本菜,壽司/刺身,(43 食評),1304,送 25里數 / 30積分
Café&Meal MUJI,16.0,"大角咀海庭道18號奧海城二期地下G78, K01-03及K05-10號舖",$101-200,日本菜,日式西餐,(48 食評),578,
牛涮鍋 Mou Mou Club,14.0,大角咀海庭道18號奧海城二期1樓128A號,$101-200,日本菜,火鍋,(21 食評),1379,
UCC Coffee Shop,33.0,大角咀海庭道18號奧海城二期UG03舖,$101-200,日本菜,咖啡店,(83 食評),870,
#OMG,13.0,大角咀海泓道1號奧海城三期地下高層UG樓59-63號舖,$101-200,日本菜,意大利菜,(26 食評),855,
黑木堂 Kurokidou,31.0,大角咀富多來商場二期鐵樹街28號地舖,$51-100,日本菜,壽司/刺身,(60 食評),1555,
一風堂 Ippudo HK,4.0,大角咀海庭道18號奧海城二期1樓106號舖,$51-100,日本菜,拉麵,(14 食評),273,
大丸ラーメン Daimaru Ramen,6.0,大角咀博文街22號地下B舖,$51-100,日本菜,拉麵,(14 食評),283,
淺月 Azazuki,4.0,大角咀鐵樹街54號地舖,$101-200,日本菜,日本菜,(7 食評),420,
元気寿司 Genki Sushi,10.0,大角咀海庭道18號奧海城二期1樓107舖,$101-200,日本菜,壽司/刺身,(25 食評),295,
吉野家 Yoshinoya,15.0,大角咀海輝道11號奧海城一期高層UG32號舖,$51-100,日本菜,快餐店,(36 食評),207,
Domon 札幌拉麵 Sapporo Ramen Domon,9.0,大角咀海庭道18號奧海城二期地下G75號舖,$51-100,日本菜,拉麵,(24 食評),491,
板長壽司 Itacho Sushi,6.0,大角咀海泓道1號奧海城三期地下G23舖,$101-200,日本菜,壽司/刺身,(12 食評),209,
茶匠 清水一芳園,4.0,大角咀海庭道18號奧海城二期UG樓UG76號舖,$51-100,日本菜,甜品/糖水,(5 食評),309,
隨意饌 Gyoza House,5.0,大角咀海庭路2號海富商場地下15A號舖,$50以下,日本菜,拉麵,(9 食評),87,
8番拉麵 Hachiban Ramen,5.0,大角咀海庭道18號奧海城二期1樓大食代6號舖,$51-100,日本菜,拉麵,(6 食評),31,
爭鮮外帶壽司 Sushi Take Out,6.0,大角咀港鐵奧運站9號舖,$50以下,日本菜,壽司/刺身,(15 食評),68,
居食屋「和民」 Watami Japanese Casual Restaurant,10.0,大角咀海輝道11號奧海城一期106舖,$101-200,日本菜,壽司/刺身,(29 食評),588,
うどん処 今助 Udon Dokoro Imasuke,12.0,大角咀大角咀道38號新九龍廣場地下001-003及005號舖,$50以下,日本菜,壽司/刺身,(38 食評),883,
加賀真味料理,6.0,大角咀博文街24號A地下,$51-100,日本菜,拉麵,(6 食評),237,
Chateraise,2.0,大角咀海庭道18號奧海城二期地下G08號舖,$50以下,日本菜,西式糕點,(4 食評),173,
Pepper Lunch Express,3.0,大角咀海庭道18號奧海城二期1樓大食代,$51-100,日本菜,Food Court,(3 食評),82,
櫻花壽司刺身專門店,4.0,大角咀大角咀道129-137號大富街地下A1B舗,$51-100,日本菜,壽司/刺身,(7 食評),115,
劍屋日本料理 Ken Ya Japanese Restaurant,1.0,大角咀角祥街43-49號地下C2號舖,$101-200,日本菜,拉麵,(4 食評),126,
京都居食屋 Kyoto Japanese Restaurant,,大角咀大全街34號,$51-100,日本菜,壽司/刺身,(8 食評),166,
將之湯日式蛋包飯 Shogun Japanese Omurice,2.0,大角咀海庭道18號奧海城二期1樓大食代8號舖,$50以下,日本菜,Food Court,(6 食評),112,
無印良品 MUJI,1.0,"大角咀海庭道18號奧海城二期地下G78, K01-03及K05-10號舖",$50以下,日本菜,小食店,(3 食評),30,
尚湯 Taste Ramen,,大角咀富貴街地下22號舖,$51-100,日本菜,拉麵,(3 食評),75,
東京手打烏冬專門店,,大角咀櫸樹街88號奧柏‧御峯地下G11&G12號舖.,$51-100,日本菜,壽司/刺身,(4 食評),75,
光仙日本料理研究所,1.0,大角咀利得街54號海角樓地下B及E號舖,$401-800,日本菜,廚師發辦,(2 食評),198,
寿司部,3.0,大角咀海庭道16號富榮花園2期地下U號舖,$50以下,日本菜,壽司/刺身,(4 食評),56,
Luna Cake,,大角咀海庭道18號奧海城二期地下G05號舖,$50以下,日本菜,西式糕點,,26,
山崎麵飽 Yamazaki Bakery,,大角咀港鐵奧運站OLY11號舖,$50以下,日本菜,麵包店,,8,
中與志,,大角咀海庭道18號奧海城二期地下G1-G10號舖,$51-100,日本菜,壽司/刺身,,6,
酒林 Sakabayashi,,大角咀利得街44號地舖,$101-200,日本菜,居酒屋,,65,
華御結 Hana-Musubi,,大角咀海輝道11號奧海城一期地下高層UGK2號舖,$50以下,日本菜,壽司/刺身,(1 食評),37,
手作之店 Tezukuri No Mise,,大角咀海泓道1號奧海城3期UG樓UG69號舖,$50以下,日本菜,雪糕/乳酪,(1 食評),24,
爭鮮外帶壽司 Sushi Take Out,,大角咀海庭路2號海富商場地下19號舖,$50以下,日本菜,壽司/刺身,,12,
尋味館日本食品專門店,,大角咀大全街59號A3舖,$50以下,日本菜,壽司/刺身,,14,
武館 BUKAN Japanese Restaurant (已搬遷),31.0,大角咀博文街19號富貴大廈西座地下20號舖,$801以上,日本菜,壽司/刺身,(44 食評),1949,
板長壽司 Itacho Sushi (已搬遷),7.0,大角咀海庭道18號奧海城二期高層地下52號舖,$101-200,日本菜,壽司/刺身,(21 食評),47,
元気寿司 Genki Sushi (已搬遷),19.0,大角咀海庭道18號奧海城二期高層地下69A舖,$101-200,日本菜,壽司/刺身,(68 食評),76,
京都居食屋 Kyoto Japanese Restaurant (已搬遷),,大角咀埃華街96號,$51-100,日本菜,日本菜,(6 食評),7,
韓國媽媽 Korea Mama,3.0,大角咀大全街39號地舖,$51-100,韓國菜,韓國菜,(5 食評),371,
金柚泰國餐廳 Pomelo Thai Restaurant,24.0,大角咀樂群街11號地下,$101-200,泰國菜,泰國菜,(30 食評),1807,
泰國市場餐廳 Market Thai,8.0,大角咀櫸樹街6號富多來商場一期地下53號舖,$51-100,泰國菜,粉麵/米線,(10 食評),150,
小泰國 Little Thailand,12.0,大角咀槐樹街6號麗華中心地下21號舖,$50以下,泰國菜,串燒,(14 食評),365,
文華雞飯(新加坡) Mandarin Chicken Rice (Singapore),47.0,大角咀中匯街17號地下,$51-100,新加坡菜,新加坡菜,(80 食評),6354,
星洲總廚 Chef de Singapore,15.0,大角咀大全街57號地下,$51-100,新加坡菜,咪嘥嘢食店,(36 食評),593,
越北牛肉粉專門店 North Viet Pho,20.0,大角咀大全街22-24號地下B1B號舖,$51-100,越南菜,粉麵/米線,(34 食評),726,
大叻越南牛肉粉餐廳 Dalat Vietnamese Restaurant,13.0,大角咀九龍大角咀道179號地下,$50以下,越南菜,粉麵/米線,(20 食評),333,
品越越式料理 La'taste Vietnamese Cuisine,8.0,大角咀海泓道1號奧海城三期地下G30號舖,$51-100,越南菜,粉麵/米線,(30 食評),902,訂座可享指定二人套餐半價優惠
西貢越南真味,11.0,大角咀博文街18號地下,$50以下,越南菜,粉麵/米線,(21 食評),709,
築匠 Zhou Jiang,6.0,大角咀鐵樹街9號金旺閣地下,$51-100,日本菜,壽司/刺身,(10 食評),872,
麥金.麥金馬拉特色茶啡室,8.0,大角咀大全街6-20號大富樓地下A2B號舖,$51-100,馬來西亞菜,粉麵/米線,(17 食評),445,
越苑,8.0,大角咀惠安街4-6號一盛大廈地下8號舖,$51-100,越南菜,越南菜,(10 食評),231,
越旺美食,37.0,大角咀大角咀道67號地下,$50以下,越南菜,咖喱,(68 食評),784,
寿司部,14.0,大角咀埃華街105D地下,$51-100,日本菜,壽司/刺身,(24 食評),470,
新月小品,3.0,大角咀鐵樹街14號富多來商場一期地下11號舖,$50以下,越南菜,越南菜,(6 食評),45,
越軒牛肉粉專門店 Pho Viet Vietnamese Restaurant,3.0,大角咀鐵樹街4號富多來商埸第1期地下16號舖,$50以下,越南菜,越南菜,(7 食評),69,
得龍粉麵茶水檔,2.0,大角咀洋松街67號地下B舖,$50以下,越南菜,車仔麵,(5 食評),103,
印度薄餅皇 Roti King Indian Fusion Cuisine,2.0,大角咀杉樹街4-16號金基大廈地下4號舖,$51-100,印度菜,咖喱,(4 食評),285,
三巡小廚,2.0,大角咀海庭道18號奧海城二期1樓大食代,$51-100,新加坡菜,Food Court,(5 食評),49,
唐明越南美食 Tong Ming Vietnam Food,1.0,大角咀埃華街105號地下C1號舖,$51-100,越南菜,粉麵/米線,(1 食評),27,
三瀧壽司刺身專門店,,大角咀櫸樹街64號富多來商場地下13號舖,$51-100,日本菜,壽司/刺身,,34,
印度薄餅皇 Roti King Indian Fusion Cuisine (已搬遷),13.0,大角咀槐樹街6號麗華中心地下3B舖,$50以下,印度菜,咖喱,(19 食評),585,
Crazy King Restaurant and Bar,6.0,大角咀大全街36號大同新邨大貴樓地下B號舖,$101-200,意大利菜,西式,(14 食評),351,
法味朵風 Brioche Dorée,5.0,大角咀櫸樹街88號奧柏‧御峯地下G07-08號舖,$50以下,法國菜,麵包店,(9 食評),342,
麵包主義 Bakeryism,,大角咀洋松街64-76號長發工業大廈4字樓2號室,$51-100,法國菜,甜品/糖水,,9,
金船長餐廳 Golden Captain Restaurant,589.0,大角咀大全街55號3A,$101-200,意大利菜,薄餅,(761 食評),11945,最優秀意大利菜餐廳開飯熱店
Cocina 3 Tapas Restaurant & Bar,245.0,大角咀海泓道1號奧海城三期地下G22號舖,$101-200,西班牙菜,酒吧,(280 食評),3307,
Simplylife The East The West,96.0,大角咀海泓道1號奧海城三期地下G19-21號舖,$101-200,西式,麵包店,(180 食評),3361,
Villa Villa,61.0,大角咀埃華街88-102號大全樓地下B及D號舖,$101-200,西式,薄餅,(69 食評),1277,十月份優惠
石一燒 Stone One Restaurant & Bar,44.0,大角咀鐵樹街10號富多來新邨一期地下13號舖,$101-200,西式,烤肉,(55 食評),1911,送 25里數 / 30積分
蠔站 Oyster Station,34.0,大角咀詩歌舞街83號亮賢居地下一號舖,$201-400,西式,海鮮,(57 食評),3950,8折 (消費滿HK$500)
Zakka,28.0,大角咀海泓道1號奧海城三期地下G29號舖,$51-100,西式,日式西餐,(49 食評),1251,
The Staff,60.0,大角咀利得街36-38號,$101-200,西式,All Day Breakfast,(67 食評),2091,
Craft Coffee Roaster,39.0,大角咀大角咀道29號地舖,$50以下,西式,咖啡店,(53 食評),3566,
Browny No.45,21.0,大角咀海庭道8號富榮花園地下45號舖,$51-100,西式,All Day Breakfast,(31 食評),1723,
Take Five,27.0,大角咀博文街4號地舖,$51-100,西式,美國菜,(43 食評),2239,
德國餐廳 Das Bier,50.0,大角咀博文街6號,$101-200,德國菜,德國菜,(79 食評),1804,送 25里數 / 30積分
Tapas Brew,51.0,大角咀博文街13號富貴大廈西座地下17號舖,$101-200,西班牙菜,酒,(64 食評),1573,送 25里數 / 30積分
Café&Meal MUJI,16.0,"大角咀海庭道18號奧海城二期地下G78, K01-03及K05-10號舖",$101-200,西式,日式西餐,(48 食評),578,
The Brew Job Coffee,15.0,大角咀海景街46號地舖,$50以下,西式,咖啡店,(21 食評),1569,
Kinson Burger & Bar,20.0,大角咀海泓道1號奧海城三期G27號舖,$51-100,西式,漢堡包,(22 食評),649,
Outback Steakhouse,8.0,大角咀海庭道18號奧海城二期G76-77號舖,$201-400,澳洲菜,扒房,(22 食評),741,
麥當勞 McDonald's,12.0,大角咀海庭道18號奧海城二期地下G40-G42號舖,$50以下,美國菜,漢堡包,(32 食評),143,
The Crescent Moon,11.0,大角咀合群街16號地下A舖,$101-200,西式,美國菜,(13 食評),486,
Paris 18 Oyster Bar & Grill,10.0,大角咀大全街6號地舖,$101-200,西式,蠔吧,(20 食評),341,送 25里數 / 30積分
Contento,8.0,大角咀海泓道1號奧海城三期地下G26號舖,$51-100,西式,All Day Breakfast,(15 食評),371,
星巴克咖啡 Starbucks Coffee,7.0,大角咀海庭道18號奧海城二期UG樓37號舖,$50以下,美國菜,沙律,(9 食評),174,
Pret A Manger,4.0,大角咀海庭道18號奧海城二期UG樓UG38號舖,$51-100,英國菜,三文治,(10 食評),202,
Bagoes,5.0,大角咀洋松街100號德讚中心12樓B室,$51-100,西式,麵包店,(6 食評),471,
McCafe,5.0,"大角咀海庭道18號奧海城二期地下G40, G41及G42號舖",$50以下,美國菜,麵包店,(5 食評),36,
Oliver's Super Sandwiches,11.0,大角咀海輝道11號奧海城一期地下高層UG06 號舖,$51-100,英國菜,三文治,(21 食評),248,
東海堂 Arome Bakery,14.0,大角咀海輝道11號奧海城一期高層地下U30-31號店,$50以下,西式,麵包店,(26 食評),93,
意樂餐廳 Cafe de Itamomo,9.0,大角咀海富苑海富商場地下2A號舖,$50以下,西式,西餐廳,(34 食評),262,
XO restaurant,2.0,大角咀櫻桃街26號A富多來新村一期地下19號舗,$51-100,西式,茶餐廳/冰室,(4 食評),24,
Godiva Chocolatier,2.0,大角咀海庭道18號奧海城二期UG樓Area A 舖,$51-100,西式,朱古力/糖果店,(3 食評),24,
Fine foods pasta,10.0,大角咀櫻桃街26號A富多來新村一期地下18號舗,$50以下,意大利菜,西式,(13 食評),492,
Das Gute,10.0,大角咀海泓道1號奧海城三期UG33舖,$50以下,西式,麵包店,(15 食評),123,
Say Cheese,6.0,大角咀海庭道18號奧海城二期地下G09號舖,$50以下,西式,甜品/糖水,(19 食評),242,
Rubato Music House Bar & Kitchen,2.0,大角咀埃華街116-118號地下,$101-200,西式,薄餅,(8 食評),80,送 25里數 / 30積分
Rustic Bistro and Café,2.0,大角咀大全街13號大有樓地下A號舖,$101-200,意大利菜,西式,(2 食評),36,
麥當勞 McDonald's,10.0,"大角咀大角咀道97-105大同新村大方樓地下J1,J2號舖",$50以下,美國菜,漢堡包,(34 食評),56,
Cali-Mex Bar & Grill,1.0,大角咀海輝道18號一號銀海G03號地舖,$101-200,美國菜,墨西哥菜,(6 食評),159,送 25里數 / 30積分
Tummy Filler,,大角咀海庭道18號奧海城二期1樓the sky戲院,$50以下,西式,小食店,(1 食評),16,
Twinkle Baker Decor,1.0,大角咀海庭道18號奧海城二期UG50A號舖,$50以下,西式,西式糕點,(1 食評),27,
Marks & Spencer - 食品部 Marks & Spencer - Food Department,1.0,大角咀海庭道18號奧海城二期G43-50舖,$51-100,西式,台式飲品,(1 食評),31,
麥當勞 McDonald's,,"大角咀塘尾道51號新港豪庭地下F, G, H舖及1樓",$50以下,美國菜,漢堡包,(3 食評),20,
Corner Stop Bar & Cafe,5.0,大角咀海景街46號地下,$51-100,西式,西餐廳,(9 食評),58,
紅酒村 Red Wine Village,,大角咀海庭道18號奧海城二期118號舖,$101-200,西式,酒,,12,
DC 甜品屋 Dessert Chateau,5.0,大角咀海富商場地下16號舖,$50以下,西式,甜品/糖水,(13 食評),57,
Visaa Bar,,大角咀杉樹街1-10號地下1號舖,$101-200,西式,酒吧,(1 食評),128,
東海堂 Arome Bakery,,大角咀大角咀道38號新九龍廣場地下088-089舖,$50以下,西式,麵包店,(2 食評),12,
Subway,,大角咀大角咀道38號新九龍廣場地下6-8號舖,$50以下,西式,三文治,,45,
four de bonheur,,大角咀海庭道18號奧海城二期UG樓,$51-100,西式,甜品/糖水,,4,
George Coffee,,大角咀海泓道1號奧海城三期UG樓UG71-73號舖,$50以下,西式,西式,,16,
McCafe,1.0,"大角咀大角咀道97-105大同新村大方樓地下J1,J2號舖",$50以下,美國菜,麵包店,(1 食評),4,
Big Chill,,大角咀通州街135號明德中心地舖,$51-100,西式,快餐店,,5,
Four De Bonheur,,大角咀海庭道18號奧海城二期UG樓Area K號舖,$201-400,西式,西式,,4,
Bless Cold-Pressed Juice,,大角咀海庭道18號奧海城二期UG樓UG03號舖,$51-100,西式,果汁,(1 食評),4,
McCafe,,"大角咀塘尾道51號新港豪庭地下F, G, H舖及1樓",$50以下,美國菜,麵包店,,2,
URBAN Bake n Take,,大角咀海庭道18號奧海城二期地下G01及10號舖Market Place by Jasons內,$50以下,西式,麵包店,,31,
星巴克咖啡 Starbucks Coffee,,大角咀大角咀道38號新九龍廣場地下009 & 011-012號舖,$50以下,美國菜,沙律,,16,
Elsie Bar & Restaurant,,大角咀晏架街8號地下,$51-100,西式,西餐廳,,19,
中世紀武器咖啡屋 Medieval Weapon Cafe (已搬遷),5.0,大角咀櫸樹街50號地舖,$51-100,愛爾蘭菜,英國菜,(5 食評),113,
Dr. Panini (已搬遷),14.0,大角咀大角咀道45號地下,$50以下,西式,西餐廳,(17 食評),347,
星巴克咖啡 Starbucks Coffee (已搬遷),17.0,大角咀海庭道18號奧海城二期G/F 78號舖,$50以下,美國菜,沙律,(25 食評),29,
euro go go (已搬遷),29.0,大角咀海庭道18 號奧海城第二期地下G20,$51-100,西式,快餐店,(62 食評),60,
Blessings Cakes & Sweets (已搬遷),12.0,大角咀博文街22號西邊舖,$50以下,西式,麵包店,(12 食評),113,
Francesca & Giovanni (已搬遷),17.0,大角咀博文街22號B地下,$50以下,西式,麵包店,(19 食評),74,
Starry Night,80.0,大角咀博文街8號地舖,$101-200,多國菜,多國菜,(91 食評),1972,送 25里數 / 30積分
LOST STARS LIVEHOUSE BAR & EATERY,151.0,大角咀利得街11號利奥坊一期地下506號舖,$101-200,多國菜,酒,(162 食評),2738,
走肉‧朋友 My Meat Run Buddy,51.0,大角咀博文街28-30號地舖,$101-200,多國菜,素食,(105 食評),5692,
星域酒廊 Skyzone Deck & Lounge,22.0,大角咀大角咀道86號九龍珀麗酒店30樓,$101-200,多國菜,酒吧,(33 食評),2350,送 25里數 / 30積分
WHY n.O.T. Specialty Coffee,6.0,大角咀海庭道18號奧海城二期1樓the sky戲院,$50以下,多國菜,麵包店,(7 食評),336,
隨心小館 Heart Cafe,7.0,大角咀角祥街31號地舖,$201-400,多國菜,海鮮,(12 食評),577,
Oyster One,6.0,大角咀晏架街48號香港西九龍絲麗酒店1樓,$201-400,多國菜,酒店餐廳,(14 食評),401,正價午膳及晚膳食品及飲品9折
一品螞蟻 Ant One,4.0,大角咀海輝道11號奧海城一期UG樓UG22號舖,$101-200,多國菜,西餐廳,(22 食評),225,
Secretspace,3.0,大角咀櫸樹街15-21號華源工業大廈8樓,$201-400,多國菜,私房菜,(3 食評),106,
食28,1.0,大角咀塘尾道205號塘尾大樓地下,$50以下,多國菜,快餐店,(1 食評),36,
Marks & Spencer - 食品部 Marks & Spencer - Food Department,1.0,大角咀海庭道18號奧海城二期G43-50舖,$51-100,多國菜,台式飲品,(1 食評),31,
君滙港會所餐廳 Harbour Green Club Banquet Room,2.0,大角咀深旺道8號君滙港會所2樓,$201-400,多國菜,會所,(2 食評),41,
點點綠 Green Dot Dot,2.0,大角咀海輝道11號奧海城一期UG層K01號舖,$50以下,多國菜,多國菜,(2 食評),12,
星匯 Solo Skyline,,大角咀必發道83號26樓全層,$201-400,多國菜,火鍋,,144,
利源海南雞小廚 LAIYUEN,,大角咀海庭道8號富榮花園地下7號鋪,$50以下,多國菜,小食店,,15,
太平洋酒吧 Bar Pacific,,大角咀杉樹街1-11號德安樓地下4號舖,$101-200,多國菜,酒吧,,54,
御宴 The Imperial Savory,,大角咀海輝道10號瓏璽5樓,$101-200,多國菜,點心,,24,
大食代 Food Republic (已搬遷),9.0,大角咀海庭道18號奧海城二期地下,$51-100,多國菜,Food Court,(32 食評),61,
點點綠 Green Dot Dot (已搬遷),,大角咀奧運站3號舖,$50以下,多國菜,多國菜,(1 食評),3,
