韓國宮 Han Guk Gung,25.0,尖沙咀漆咸道漆咸圍5-7號宏富大廈地下,$101-200,韓國菜,燒烤,(40 食評),1089,
朴先生韓國料理炸雞類 Mr.Park Korean Restaurant Chicken Menu,4.0,土瓜灣譚公道77號地舖,$51-100,韓國菜,韓式炸雞,(9 食評),207,
三食 Samsik,3.0,觀塘成業街7號東廣場地下49-50號舖,$51-100,韓國菜,快餐店,(17 食評),234,
南대門韓國料理 Namdaemoon One Korean Restaurant,22.0,尖沙咀金巴利街1B恆港中心地下3號,$101-200,韓國菜,韓國菜,(47 食評),503,
Roll & Mari,12.0,尖沙咀金巴利街1號E舖,$51-100,韓國菜,快餐店,(38 食評),338,
東山餃子 Dongsan Dumpling,1.0,紅磡紅鸞道38號香港嘉里酒店1樓百味村,$51-100,韓國菜,韓國菜,(1 食評),300,
Hungry Korean,,九龍灣牛頭角道77號淘大商場一期地下G113號鋪,$51-100,韓國菜,快餐店,(18 食評),308,
O'taste,2.0,尖沙咀金巴利街7-12號地下,$50以下,韓國菜,韓國菜,(4 食評),170,
漢城美食 Han Sung Korean Cuisine,20.0,旺角廣華街3-13號廣輝大廈地下15號舖,$51-100,韓國菜,韓國菜,(53 食評),926,
韓食味家韓國小食,3.0,油塘鯉魚門道80號鯉魚門廣場鯉魚門街市地下73號舖,$50以下,韓國菜,薄餅,(5 食評),162,
浪漫滿屋 Full House,34.0,深水埗欽州街37號西九龍中心8樓美食廣場32號舖,$50以下,韓國菜,韓國菜,(43 食評),936,
Kim's Korean BBQ Restaurant,5.0,土瓜灣馬頭涌道93-103A號美誠大廈地下,$101-200,韓國菜,烤肉,(9 食評),307,
Bobbybox,2.0,紅磡紅鸞道38號香港嘉里酒店1樓百味村,$50以下,韓國菜,韓國菜,(3 食評),77,
韓國味家 Korean C & Hr Sweeken,6.0,深水埗欽州街37號西九龍中心8樓美食廣場59號舖,$50以下,韓國菜,Food Court,(13 食評),148,
M Plus,7.0,尖沙咀漆咸圍1-3號多福大廈地下D&E號舖,$101-200,韓國菜,韓國菜,(8 食評),500,
韓國媽媽 Korea Mama,3.0,大角咀大全街39號地舖,$51-100,韓國菜,韓國菜,(5 食評),370,
清溪川韓國配菜,3.0,紅磡湖光街1-7號聯成大廈燕安閣地下,$51-100,韓國菜,韓國菜,(5 食評),51,
韓國屋 Korea House,,大角咀海庭道18號奧海城二期1樓大食代,$51-100,韓國菜,Food Court,(2 食評),34,
韓食點 K-Food Dim,1.0,觀塘順利邨順利商場P02號舖,$50以下,韓國菜,韓國菜,(1 食評),22,
木槿韓國料理 Hibiscus Korean Restaurant,3.0,土瓜灣北帝街33號地舖,$51-100,韓國菜,韓國菜,(7 食評),116,
HANG A RI Korean Restaurant,4.0,紅磡崇潔街30號地下,$50以下,韓國菜,韓國菜,(5 食評),297,
第一烤肉 N.1 Korean BBQ Restaurant,2.0,旺角通菜街78號地舖,$101-200,韓國菜,韓國菜,(3 食評),157,
粒粒雪糕 Mini melts,1.0,鑽石山龍蟠街3號荷里活廣場3樓Kiosk 320E號舖,$50以下,韓國菜,雪糕/乳酪,(1 食評),65,
韓家韓國料理 Han Ga Korean Restaurant,6.0,觀塘駿業街56號中海日升中心1樓G號舖,$51-100,韓國菜,三文治,(14 食評),73,
炑八Taste MeokBang Taste,,油塘高超道38號大本型3樓308-312舖大食代R2號檔,$101-200,韓國菜,韓燒,(3 食評),39,
Hygge Cafe & Bar,2.0,尖沙咀漆咸道南 29號溫莎大廈地下2-3號舖,$51-100,韓國菜,咖啡店,(3 食評),395,
Chicken & Beer,1.0,大角咀博學里9A號富多來商場一期地下33A號舖,$50以下,韓國菜,韓式炸雞,(1 食評),40,
Square 12,,尖沙咀北京道65-69號環球商業大廈12樓,$201-400,韓國菜,串燒,,348,
南대門3號 Namdaemoon Three Korean Restaurant,,尖沙咀金巴利道65-67號太平洋大廈地下3號,$101-200,韓國菜,韓國菜,(3 食評),61,
韓國料理清溪川 all take away,1.0,尖沙咀金巴利街1號地舖,$51-100,韓國菜,韓國菜,(1 食評),38,
江南韓國食品 Gang Nam Korea Food Market,,旺角煙廠街9號興發商業大廈地下1號舖,$51-100,韓國菜,韓國菜,(1 食評),67,
粒粒雪糕 Mini Melts,1.0,九龍灣宏照道38號企業廣場5期Megabox9樓童真天地,$50以下,韓國菜,雪糕/乳酪,(2 食評),26,
韓國伴飯 Korean Mixed Rice,,深水埗欽州街37號西九龍中心8樓美食廣場37號,$50以下,韓國菜,韓國菜,(3 食評),66,
La Luna Bar & Lounge,1.0,尖沙咀赫德道17號海信大廈地下,$101-200,韓國菜,酒,(3 食評),240,
韓國屋 Korea House,36.0,旺角亞皆老街8號朗豪坊4樓F3號舖,$51-100,韓國菜,Food Court,(117 食評),397,
HARAM Korean Dessert Shop,,尖沙咀漆咸圍2-4號金時商業大廈地下7號舖,$50以下,韓國菜,甜品/糖水,(1 食評),40,
韓和韓國料理,,尖沙咀廣東道68號,$101-200,韓國菜,韓國菜,,37,
星匯 Solo Skyline,,大角咀必發道83號26樓全層,$201-400,韓國菜,火鍋,,144,
Bakery Plus,,尖沙咀河內道18號K11購物藝術館B1樓Market Place內,$50以下,韓國菜,西式糕點,,191,
食道樂 Sicdorak,,紅磡崇潔街21號崇信樓地舖,$101-200,韓國菜,韓式炸雞,,35,
韓國餐室 Korean Canteen,1.0,新蒲崗景福街61號地舖,$51-100,韓國菜,快餐店,(3 食評),15,
韓國屋 Korea House,5.0,尖沙咀廣東道30號新港中心地庫大食代,$51-100,韓國菜,Food Court,(15 食評),79,
粒粒雪糕 minimelts,,太子彌敦道750號始創中心2樓Kiosk F,$50以下,韓國菜,雪糕/乳酪,,7,
梨花園 Express Lee Fa Yuen Express,5.0,觀塘觀塘道418號創紀之城五期(apm)2樓cookedDeli by city'super,$50以下,韓國菜,Food Court,(11 食評),113,
南대門 Namdaemoon Korean B.B.Q. Restaurant,10.0,尖沙咀金巴利道65-67號太平洋大廈地下2號舖,$101-200,韓國菜,烤肉,(21 食評),389,
新沙 Sinsa Eat,,尖沙咀柯士甸道西3號香港西九龍站抵港大堂B2層堂前食坊,$51-100,韓國菜,Food Court,,3,
韓國屋 Korea House,,佐敦彌敦道216-228號恆豐中心低層3B號舖大食代,$51-100,韓國菜,韓國菜,,1,
千顧 Chingu Foodie,,荔枝角青山道588-592號永盛工業大廈地下G15號舖,$50以下,韓國菜,三文治,,6,
白飯神偷-韓國醬油蟹專門店 Bapman (非門市),,,$201-400,韓國菜,網店/食品分銷,,46,
K-Roll,,尖沙咀港鐵九龍站80號舖,$51-100,韓國菜,韓國菜,,51,
貝貝家,,深水埗欽州街37號西九龍中心8樓美食廣場8F37,$50以下,韓國菜,Food Court,,4,
Petit Maison,,尖沙咀麼地道30號Mody House 12樓,$101-200,韓國菜,西餐廳,,67,
Club All In Korean Karaoke,,尖沙咀加連威老道92號幸福中心,$101-200,韓國菜,韓國菜,,11,
韓國錦城飯店 Korea Kam Sing Restaurant (已搬遷),115.0,尖沙咀堪富利士道5號地下,$101-200,韓國菜,燒烤,(182 食評),1801,
韓國媽媽 Korea Mama (已搬遷),31.0,大角咀大全街13號大有樓地下A舖,$51-100,韓國菜,韓國菜,(36 食評),360,
ChumChum味 ChumChumMi (已搬遷),29.0,尖沙咀彌敦道132號美麗華商場2樓9-10號舖,$201-400,韓國菜,酒,(45 食評),351,
阿里朗韓國餐廳 Arirang Korean Restaurant (已搬遷),19.0,尖沙咀廣東道3-27號海港城海運大廈地下OT607號舖,$101-200,韓國菜,韓國菜,(43 食評),163,
梨花園 Lee Fa Yuen Express (已搬遷),24.0,觀塘觀塘道418號創紀之城五期(apm)1樓美食廣場6號舖,$51-100,韓國菜,Food Court,(65 食評),79,
韓食時代 (已搬遷),2.0,紅磡德民街29號德民大厦地下E1舖,$50以下,韓國菜,韓國菜,(3 食評),54,
韓食家 Baab (已搬遷),37.0,大角咀海庭道18號奧海城二期地下G38-G39號舖,$51-100,韓國菜,韓國菜,(80 食評),101,
明洞Express (已搬遷),56.0,尖沙咀天文臺道8號,$50以下,韓國菜,外賣店,(103 食評),276,
韓一石頭鍋 (已搬遷),35.0,九龍城福佬村道3號地下,$51-100,韓國菜,韓國菜,(63 食評),204,
韓點 HonDim (已搬遷),2.0,深水埗欽州街37號西九龍中心美食廣塲8樓59號舖,$50以下,韓國菜,Food Court,(6 食評),16,
Honey Granny (裝修中),11.0,九龍城賈炳達道128號九龍城廣場UG18號舖,$50以下,韓國菜,雪糕/乳酪,(21 食評),177,
阿來泰式地道風味 Aroy Khao Man Gai,364.0,旺角通菜街97號地舖,$51-100,泰國菜,泰國菜,(426 食評),15077,
Cambo ขุนทอง,383.0,尖沙咀彌敦道100號The ONE 4樓L403舖,$101-200,泰國菜,越南菜,(622 食評),22921,送 25里數 / 30積分
泰燒遙 Thai on 5 Seafood Grill and Bar,350.0,尖沙咀諾士佛臺1號5樓,$201-400,泰國菜,海鮮,(411 食評),17853,送 25里數 / 30積分
億饍 Multi Taste,280.0,旺角彌敦道558-560號譽發廣場4樓,$101-200,泰國菜,湯品,(330 食評),6854,"生日快樂,免費送蛋糕(5人 以上)或白酒一支(9人以上)"
泰聚 Thai Gather Restaurant & Bar,233.0,太子花園街239號嘉慶苑地下,$101-200,泰國菜,咖喱,(259 食評),5398,15% Off
泰斗 Thai Master Restaurant & Bar,236.0,尖沙咀海防道38-40號中達大廈4樓全層,$201-400,泰國菜,泰國菜,(289 食評),13843,送 25里數 / 30積分
新泰東南亞餐廳 Sun Thai Restaurant,179.0,尖沙咀北京道12A號太子集團中心8樓,$101-200,泰國菜,咖喱,(210 食評),8256,
泰屋 Sawadee Thai,197.0,旺角彌敦道726號2樓,$101-200,泰國菜,海鮮,(224 食評),6543,
1988,184.0,觀塘興業街16-18號美興工業大廈A座1樓A3室,$51-100,泰國菜,甜品/糖水,(209 食評),7415,
小曼谷海鮮燒烤屋 Mini Bangkok Seafood and Grill,223.0,九龍城太子道西398號御太子地下1-3號舖,$101-200,泰國菜,海鮮,(286 食評),9406,送 25里數 / 30積分
Add Some Thai Restaurant,172.0,觀塘開源道62號駱駝漆大廈一座9樓D室,$101-200,泰國菜,包場派對,(236 食評),8643,送 25里數 / 30積分
泰象館 Thai Chang House,163.0,九龍城城南道48號地下,$101-200,泰國菜,海鮮,(225 食評),6649,送 25里數 / 30積分
藍象泰國餐廳 Blue Elephant Thai Brasserie,214.0,尖沙咀廣東道3-27號海港城港威商場3樓3303號舖,$101-200,泰國菜,咖喱,(290 食評),6944,
Orange Elephant Thai Restaurant,189.0,九龍城啟德道31-33號地舖,$101-200,泰國菜,泰國菜,(243 食評),6537,
泰邊爐 Thai Bin Lo,129.0,旺角彌敦道628號瓊華中心9樓,$101-200,泰國菜,火鍋,(160 食評),5254,送 25里數 / 30積分
泰贊- 創意泰餐廳 So Thai So Good,112.0,尖沙咀彌敦道132號美麗華廣場一期1樓105號舖,$51-100,泰國菜,泰國菜,(228 食評),8689,
金寶泰國菜館 Cambo Thai Restaurant,118.0,九龍城衙前塱道25號,$101-200,泰國菜,海鮮,(150 食評),2741,送 25里數 / 30積分
Lemongrass,112.0,大角咀海庭道18號奧海城二期1樓128B號舖,$101-200,泰國菜,西餐廳,(156 食評),3241,自選餐牌88折
阿來泰式地道風味 Aroy Khao Man Gai,104.0,長沙灣東沙島街162號地下,$51-100,泰國菜,泰國菜,(121 食評),1550,
Greyhound Café,148.0,旺角太子道西193號新世紀廣場3樓301-302號舖,$201-400,泰國菜,酒,(272 食評),7632,
真心泰國菜館 Bonnie's Thai Restaurant,116.0,旺角砵蘭街215號朗晴坊2樓,$101-200,泰國菜,海鮮,(193 食評),1625,
倪姐泰國美食 Ngai Jei Thai Food Restaurant,84.0,九龍城侯王道9號地下A舖,$51-100,泰國菜,咖喱,(92 食評),1631,
小曼谷泰國美食 Mini Bangkok Thai Food,265.0,九龍城南角道8-10號,$101-200,泰國菜,泰國菜,(449 食評),5879,送 25里數 / 30積分
泰灜 Thai-In,74.0,佐敦吳松街141號地舖,$101-200,泰國菜,泰國菜,(92 食評),2888,
御泰坊-泰越菜 King & I-Thai and Vietnamese,310.0,觀塘觀塘道418號創紀之城五期(apm)4樓1-2號舖,$101-200,泰國菜,無肉餐單,(498 食評),6260,
真心泰國菜館 Bonnie Restaurant,91.0,旺角通菜街16號地下,$101-200,泰國菜,泰國菜,(134 食評),876,
Namo Avant Thai Restaurant,74.0,"尖沙咀麼地道68號帝國中心G2-4,18-22號舖",$201-400,泰國菜,酒吧,(104 食評),6653,訂座享全日堂食85折優惠
Greyhound Café,120.0,九龍塘達之路80號又一城2樓L2-42號舖,$201-400,泰國菜,無肉餐單,(252 食評),4337,
Erawan Thai Premium,62.0,尖沙咀亞士厘道24-38號天星大廈4樓,$101-200,泰國菜,咖喱,(84 食評),4982,
泰基隆 Thai Ki Lung,57.0,深水埗基隆街241號地舖,$101-200,泰國菜,海鮮,(61 食評),1102,
金蘭花泰國菜館 Golden Orchid Thai Restaurant,125.0,九龍城龍崗道10-12號,$101-200,泰國菜,泰國菜,(193 食評),2006,
泰麵膳 Boat Noodle,54.0,尖沙咀寶勒巷1號玫瑰大廈地下E&F1號舖,$51-100,泰國菜,粉麵/米線,(109 食評),6131,
阿來東南亞風味 Aroy Southeast Asia,75.0,旺角廣華街38號地舖,$51-100,泰國菜,新加坡菜,(78 食評),676,
泰廚房子 KHAP & KA,64.0,九龍灣偉業街33號德福廣場一期平台 P8A號舖,$101-200,泰國菜,泰國菜,(116 食評),1979,
昌發泰國粉麵屋 Cheong Fat Thai Food,148.0,九龍城城南道25-27號地下,$51-100,泰國菜,泰國菜,(226 食評),6676,
羅勇泰國粉麵 Rayong Thai Noodle,68.0,尖沙咀尖沙咀厚福街7號地下,$50以下,泰國菜,粉麵/米線,(111 食評),2396,
亞泰廚房 Chef Thai,57.0,九龍城獅子石道77號地舖,$51-100,泰國菜,泰國菜,(69 食評),722,
新曼谷泰國菜館 New Bangkok Restaurant,60.0,尖沙咀寶勒巷21-23A號寶利商業大廈地庫,$51-100,泰國菜,泰國菜,(73 食評),1936,"惠顧滿港幣1,000元可享9折"
Orange Elephant Thai Restaurant,60.0,大角咀博文街42號,$101-200,泰國菜,馬來西亞菜,(74 食評),1242,
新泰東南亞餐廳 Sun Thai Restaurant,74.0,尖沙咀加拿分道25-31號國際商業信貸銀行大廈地下1A舖及地庫,$101-200,泰國菜,咖喱,(78 食評),754,全單8折
Lemon Grass Thai & BBQ,52.0,觀塘聯安街23號A地舖,$51-100,泰國菜,泰國菜,(83 食評),3148,送 25里數 / 30積分
Amazing,41.0,油麻地九龍窩打老道23號城景國際大堂,$101-200,泰國菜,咪嘥嘢食店,(63 食評),5661,2位或以上預訂Amazing 桃芒蜜語·下午茶自助餐，可享9折優惠
泰發泰國餐廳 Thai Fat Thai Restaurant,76.0,九龍城城南道8號東昇閣地下,$101-200,泰國菜,泰國菜,(102 食評),2631,
峇里餐廳 Bali Restaurant,54.0,佐敦廟街237-247號六福珠寶中心地下D及E號舖,$101-200,泰國菜,咪嘥嘢食店,(76 食評),2703,送 25里數 / 30積分
亞萊泰 Aroi Thai,37.0,九龍灣牛頭角道77號淘大商場地下G266-270號舖,$101-200,泰國菜,泰國菜,(83 食評),945,
泰麵膳 Boat Noodle,44.0,旺角豉油街108號地下,$51-100,泰國菜,粉麵/米線,(66 食評),2504,
泰 Thai Western,45.0,黃大仙環鳳街19號地舖,$101-200,泰國菜,泰國菜,(57 食評),582,
泰金國 Thai Cold City,41.0,九龍城衙前圍道36號A地舖,$51-100,泰國菜,泰國菜,(58 食評),2432,
金泰子泰國餐廳 Golden Prince Thai Restaurant,37.0,太子柏樹街17A號地舖,$50以下,泰國菜,咖喱,(45 食評),923,
泰風情,59.0,九龍城衙前圍道62號地舖,$50以下,泰國菜,泰國菜,(81 食評),826,
莎娃迪卡 Sawasdee Krub Thai Restaurant,50.0,佐敦廟街269號地舖,$51-100,泰國菜,咪嘥嘢食店,(65 食評),1168,
亞萊泰 Aroi Thai,28.0,黃大仙龍翔道136號黃大仙中心北館1樓N141號舖,$101-200,泰國菜,泰國菜,(65 食評),865,
小曼谷泰國美食 Mini Bangkok Thai Food,37.0,九龍城南角道9-11號地下,$101-200,泰國菜,泰國菜,(49 食評),543,
好運泰國美食,52.0,新蒲崗康強街32-34號康強大廈B座19舖,$50以下,泰國菜,咖喱,(73 食評),1034,
泰屋,23.0,九龍城城南道47號地下,$50以下,泰國菜,泰國菜,(35 食評),2089,
大雄海南雞 Thai Hung,40.0,"觀塘駿業街駿業熟食市場1樓42,46及47號舖",$51-100,泰國菜,雞煲,(51 食評),627,
泰皇閣泰國菜館 Thai Palace Restaurant,47.0,九龍城衙前塱道15號地舖,$101-200,泰國菜,酒,(56 食評),532,全單85折
鴻陞泰國菜,33.0,九龍城城南道6號,$51-100,泰國菜,包場派對,(33 食評),279,
隆姐泰國美食館 Lung Jie Thai Restaurant,101.0,九龍城南角道18號地下,$101-200,泰國菜,泰國菜,(165 食評),2979,
金不換泰國餐廳 Sweet Basil Thai Cuisine,46.0,尖沙咀廣東道3-27號海港城海運大廈2樓OT260-OT263號舖,$101-200,泰國菜,泰國菜,(76 食評),3189,
榶意泰式粉麵,28.0,油塘嘉榮街2-4號油塘中心嘉發廣場6-7號舖,$50以下,泰國菜,粉麵/米線,(38 食評),843,
泰仔美食 Thai Hot,30.0,九龍城九龍城南角道30-32號地下,$51-100,泰國菜,泰國菜,(45 食評),1317,
昭拍耶2 Chao 2 by Chaophraya,30.0,九龍城南角道22號地舖,$101-200,泰國菜,海鮮,(45 食評),2754,
Little Old Town,26.0,九龍灣偉業街33號德福廣場4樓419-420號舖,$51-100,泰國菜,新加坡菜,(61 食評),1030,
龍華軒咖啡室 Coffee Lowa,27.0,旺角登打士街36號恆威商業中心17樓,$51-100,泰國菜,樓上cafe,(45 食評),3663,
泰闊and一燒 Thai Food and Grill,25.0,油麻地碧街38號協群商業大廈地下H舖,$50以下,泰國菜,串燒,(31 食評),633,
Thai-ger,16.0,荔枝角長義街9號D2 Place 1期1樓101號舖,$51-100,泰國菜,咖喱,(27 食評),1012,
金泰子泰國餐廳 Golden Prince Thai Restaurant,23.0,佐敦柯士甸道108 號耀基大廈地下,$51-100,泰國菜,咖喱,(37 食評),1306,
昭拍耶 CHAO PHRAYA,54.0,九龍城龍崗道19號地下,$101-200,泰國菜,海鮮,(94 食評),3203,
泰妹 Thai Mui Restaurant,25.0,觀塘興業街4號The Wave 1樓103號舖,$51-100,泰國菜,泰國菜,(39 食評),557,
泰潮 Thai Chiu,63.0,深水埗福榮街101號地舖,$51-100,泰國菜,泰國菜,(195 食評),2375,
紅椒力量 Pepper Power,29.0,紅磡必嘉街紅磡灣中心12號地舖,$50以下,泰國菜,粉麵/米線,(48 食評),630,
泰苑小食 Amporn Thaifood,107.0,九龍城侯王道48號九龍城市政大廈3樓,$101-200,泰國菜,海鮮,(205 食評),1270,
金滿象正宗泰國菜 ICON THAI,34.0,旺角廣華街翠園2期地下6號舖,$51-100,泰國菜,海鮮,(70 食評),1730,
晴苑泰國菜 Sunny Thai Restaurant,48.0,大角咀埃華街91-93號地下,$51-100,泰國菜,泰國菜,(82 食評),1309,
泰妃雞,85.0,旺角豉油街74號地舖,$51-100,泰國菜,粉麵/米線,(168 食評),1528,
"Nahm, Vietnamese & Thai",52.0,尖沙咀柯士甸道西1號圓方(Elements)1樓1044-45號舖,$101-200,泰國菜,適合駕駛人士,(122 食評),3092,送 25里數 / 30積分
泰‧蘭花 Thai Orchids Café & Bar,32.0,九龍灣宏照道38號MegaBox 11樓9號舖,$101-200,泰國菜,無肉餐單,(89 食評),857,
金坊泰國美食 Golden Thai,25.0,紅磡民泰街43號地下C1舖,$101-200,泰國菜,泰國菜,(65 食評),1094,
黃珍珍泰國菜館 Wong Chun Chun Thai Restaurant,76.0,九龍城打鼓嶺道23號百營中心地庫至1樓,$101-200,泰國菜,咪嘥嘢食店,(165 食評),2321,
金泰燒烤 Golden Thai BBQ,71.0,九龍城太子道西386A-B,$51-100,泰國菜,泰國菜,(109 食評),1860,
為食雞私房工場,24.0,荔枝角長沙灣道883號億利工業中心一樓九室,$50以下,泰國菜,外賣店,(52 食評),1666,
漁樂 Lime Fish,17.0,長沙灣青山道399號喜薈商場1樓1號舖,$51-100,泰國菜,越南菜,(30 食評),631,
水門泰式海南雞飯專門店,15.0,深水埗欽州街37號西九龍中心8樓美食廣場55號舖,$50以下,泰國菜,快餐店,(23 食評),596,
Green Thai,22.0,油塘高超道38號大本型1樓115號舖,$51-100,泰國菜,薄餅,(55 食評),897,
爸B燒 Bar B Q,18.0,新蒲崗富源街19號地舖,$50以下,泰國菜,串燒,(25 食評),701,
新曼谷泰菜 New Bangkok Restaurant,11.0,尖沙咀彌敦道63號iSQUARE國際廣場6樓607號舖,$51-100,泰國菜,泰國菜,(36 食評),1200,
泰地道 Traditional Of Thai,22.0,佐敦文苑街20號文苑樓地舖,$201-400,泰國菜,海鮮,(30 食評),545,
同心泰國菜館 Ruamjai Thai Restaurant,30.0,九龍城打鼓嶺道11-13號地下,$101-200,泰國菜,泰國菜,(59 食評),864,
泰紅泰國美食 Red Thai,22.0,新蒲崗太子道東638號Mikiki 1樓116號舖,$101-200,泰國菜,咖喱,(48 食評),553,
泰禾美 Thai-E-San Ram Mis,11.0,九龍城龍崗道11-13號地舖,$101-200,泰國菜,海鮮,(17 食評),763,
鄭​師姐泰式素食私房菜,10.0,尖沙咀麼地道16號半島大廈8樓E座,$101-200,泰國菜,素食,(16 食評),2051,
Soi Eat Thai Cuisine,14.0,長沙灣青山道454號地舖,$101-200,泰國菜,Fine Dining,(35 食評),1838,
黃珍珍泰國菜館 Wong Chun Chun Thai Restaurant,13.0,佐敦彌敦道219號莊士倫敦廣場3樓,$101-200,泰國菜,海鮮,(39 食評),1140,
Nara Thai Restaurant & Bar,35.0,尖沙咀麼地道75號南洋中心地下14-19號舖,$101-200,泰國菜,酒,(67 食評),2049,
三妹嘜,35.0,佐敦吳松街109號地下,$101-200,泰國菜,西餐廳,(56 食評),1276,
隆姐泰國美食館 Lung Jie Thai Restaurant,53.0,九龍城衙前塱道2A-B地下,$101-200,泰國菜,粉麵/米線,(86 食評),1481,
Mangosteen Thai Cuisine,15.0,尖沙咀亞士厘道27號捷利商業大廈一樓,$101-200,泰國菜,泰國菜,(35 食評),610,
越泰軒 Good Thai,15.0,長沙灣青山道274號地舖,$50以下,泰國菜,粉麵/米線,(26 食評),356,
小曼谷海鮮燒烤屋 Mini Bangkook Seafood and Grill,12.0,九龍城衙前塱道1A地下,$101-200,泰國菜,海鮮,(19 食評),304,
強記小廚,24.0,旺角甘霖街31﹣33號地下,$101-200,泰國菜,中菜館,(34 食評),1585,
船長 泰國船麵工房 Captain Thai,6.0,觀塘成業街19-23號成業工業大廈1樓22室,$51-100,泰國菜,泰國菜,(13 食評),922,
泰嘉雯泰式去骨海南雞飯 Thai Food,11.0,大角咀櫸樹街32號富多來商場地下,$50以下,泰國菜,小食店,(20 食評),521,
好意泰國餐廳 GoodWill Thai Restaurant,14.0,觀塘康寧道64號地舖,$50以下,泰國菜,海鮮,(16 食評),144,
泰好味 Thai Good Food,41.0,九龍城城南道2號,$101-200,泰國菜,海鮮,(65 食評),1031,
泰閣 Koon Thai Cuisine,33.0,尖沙咀廣東道33號中港城2座平台3號舖,$101-200,泰國菜,海鮮,(62 食評),2130,於晚上六時後訂座可享85折優惠
興興 Hing Hing,23.0,觀塘康寧道55號地下,$50以下,泰國菜,泰國菜,(31 食評),637,
more food & creation,11.0,觀塘鴻圖道26號威登中心地舖,$101-200,泰國菜,咖啡店,(41 食評),909,
泰濃麵 Siam Noodles,6.0,尖沙咀樂道7號嘉樂大廈地下A舖,$51-100,泰國菜,泰國菜,(8 食評),576,
越泰豐 Yuet Thai Fong,9.0,觀塘宜安街9-27號有利大樓地下H室,$51-100,泰國菜,粉麵/米線,(29 食評),447,
泰國路邊街美食,45.0,九龍城城南道26號地舖,$51-100,泰國菜,泰國菜,(65 食評),926,
泰式燒王 Thai BBQ,31.0,九龍城南角道19號地下,$101-200,泰國菜,串燒,(52 食評),971,
小泰豆泰式創意料理 Little Thai Bean Cuisine,9.0,深水埗荔枝角道332號地下,$51-100,泰國菜,泰國菜,(16 食評),268,
紅蟻泰國菜 Thai Aroy,10.0,牛頭角定業街1號地下,$51-100,泰國菜,小食店,(18 食評),428,
味力曼谷 Thai Food,7.0,深水埗欽州街37號西九龍中心8樓8F03-04號舖,$50以下,泰國菜,Food Court,(15 食評),124,
樹屋泰菜 Tree House,9.0,旺角花園街123號花園街街巿3樓,$50以下,泰國菜,咖喱,(16 食評),815,
香葉泰國菜館 Pandan Leaf Thai Restaurant,9.0,尖沙咀漆咸道南45-51號其士大廈地下C-D號舖,$101-200,泰國菜,咖喱,(26 食評),419,
泰國人海南雞 Koon Thai Hai Nam Chicken,8.0,油麻地砵蘭街2-4號常安樓地下1號舖,$51-100,泰國菜,泰國菜,(23 食評),217,
串得囍串燒,10.0,旺角黑布街104號地下H1號舖,$50以下,泰國菜,串燒,(15 食評),458,
檸檬泰國餐廳 Lemon Thai Restaurent,9.0,九龍城城南道38-40號地舖,$101-200,泰國菜,泰國菜,(16 食評),522,
鴻陞小食,22.0,九龍城城南道6-6A號地下,$51-100,泰國菜,泰國菜,(27 食評),593,
安柏娃 Amphawa,5.0,佐敦吳松街102號地下,$51-100,泰國菜,海鮮,(9 食評),666,OpenRice會員經由 OpenRice綱上訂座可享9折优惠
金麥泰泰國菜館 Golden Wheat Thai Restaurant,75.0,九龍城南角道34號地下,$101-200,泰國菜,粉麵/米線,(115 食評),858,
泰辣廚泰國粉麵燒烤屋 Thai Funny kitchen,8.0,土瓜灣譚公道16A長城大廈地舖,$51-100,泰國菜,海鮮,(13 食評),269,
金香茅泰國菜館 Golden Lemon Grass,27.0,紅磡必嘉街地下90B號舖,$51-100,泰國菜,粉麵/米線,(47 食評),1010,
漁樂 Lime Fish,4.0,黃大仙正德街103號黃大仙中心南館UG樓UG5號舖,$51-100,泰國菜,越南菜,(21 食評),233,
新泰興,4.0,深水埗元州街213號美居中心地下21號舖,$51-100,泰國菜,串燒,(6 食評),862,
私+泰 Private Thai,10.0,尖沙咀寶勒巷13-15號寶力大廈6樓C室,$201-400,泰國菜,私房菜,(12 食評),1141,
泰國小泰飛菜館,4.0,深水埗福榮街2A-2B號地舖,$101-200,泰國菜,泰國菜,(6 食評),163,
皇后泰國廚房 Queen's Kitchen,10.0,尖沙咀廣東道116-120號海威商業中心16樓,$201-400,泰國菜,私房菜,(16 食評),852,9折優惠
金滿象正宗泰國菜 ICON THAI,15.0,太子花園街224B號地下B舖,$51-100,泰國菜,海鮮,(45 食評),671,
泰式名廚 Thai Kitchen,6.0,大角咀鐵樹街22號富多來商場一期地下7號舖,$51-100,泰國菜,泰國菜,(10 食評),131,
極品泰國菜館 Great Thai Food,6.0,大角咀中匯街16號中美樓地下29號舖,$51-100,泰國菜,泰國菜,(9 食評),169,
友誼泰國菜館 Friendship Thai Food,14.0,九龍城啟德道38號地下,$51-100,泰國菜,泰國菜,(22 食評),679,
泰仔串燒,5.0,土瓜灣鶴齡街2A地舖,$50以下,泰國菜,粉麵/米線,(7 食評),254,
歌聲光頭佬泰國菜 Thailand Netsuwan,10.0,深水埗黃竹街39A號地下,$50以下,泰國菜,泰國菜,(17 食評),491,
泰一流泰國菜 Power Chef,6.0,慈雲山毓華街貫華里2號地下A號舖,$50以下,泰國菜,咖喱,(12 食評),213,
泰好味,4.0,觀塘海濱道190號觀塘碼頭熟食市場1樓14-23號舖,$51-100,泰國菜,泰國菜,(6 食評),561,
大眼仔美食 Karson's Kitchen,6.0,新蒲崗大有街32號泰力工業中心地下10號舖,$50以下,泰國菜,粉麵/米線,(10 食評),220,
興隆泰國美食,32.0,九龍城城南道18號,$101-200,泰國菜,泰國菜,(47 食評),1038,
泰式燒烤 Chai Rung Thai Food,5.0,九龍城南角道33號A地下,$50以下,泰國菜,串燒,(8 食評),531,
Thaisiri BBQ,5.0,深水埗營盤街138號地下7號舖,$51-100,泰國菜,烤肉,(6 食評),197,
鴻運食屋,8.0,藍田德田邨德田商場地下4A舖,$50以下,泰國菜,小食店,(13 食評),145,
曼活泰茶 Cha Sod Thai Tea,5.0,旺角廣華街1號仁安大廈地下G1D號舖,$50以下,泰國菜,果汁,(10 食評),366,
