name,location,price,country,style,likes,review,bookmark,discount_info
首爾家韓國料理 Seoul House,銅鑼灣邊寧頓街13-15號隆堡柏寧頓酒店1樓,$101-200,法國菜,西餐廳,196,(245 食評),8036,送 25里數 / 30積分
熨烤達人 Mr. Iron,旺角洗衣街147號地下,$101-200,韓國菜,烤肉,204,(271 食評),8476,送 25里數 / 30積分
E Molto Buono,銅鑼灣霎西街28號必發商業大廈2樓,$401-800,韓國菜,烤肉,195,(204 食評),6400,送 25里數 / 30積分
Nardo's Cafe,旺角彌敦道594-596號旺角新城8樓全層,$51-100,意大利菜,Fine Dining,140,(176 食評),6754,送 25里數 / 30積分
Dream Cafe,旺角砵蘭街215號朗晴坊5樓全層,$101-200,西式,樓上cafe,193,(235 食評),3256,送 25里數 / 30積分
Aqua,尖沙咀北京道1號29樓,$401-800,西式,薄餅,165,(306 食評),27158,送 25里數 / 30積分
NeNe Chicken,旺角亞皆老街8號朗豪坊11樓30號舖,$101-200,日本菜,海鮮,179,(334 食評),7148,送 25里數 / 30積分
大喜屋日本料理 Daikiya Japanese Restaurant,銅鑼灣軒尼詩道502號黃金廣場7樓,$201-400,韓國菜,韓式炸雞,216,(257 食評),12150,優惠時段只需$193起，適用於19：30前離座，21：15後入座，該優惠不得與其他優惠共用，加一以原價計算。
Wing's Kitchen,尖沙咀漆咸道南45-51號其士大廈地下C及D舖,$101-200,日本菜,日式放題,217,(358 食評),14637,訂座享晚市88折優惠
Darci by Aldou,元朗鳳攸南街9號好順利大廈地下60號,$101-200,意大利菜,薄餅,174,(205 食評),5597,送 25里數 / 30積分
辛安東元祖奶奶雞 Spicy Andong,旺角白布街20號地下,$101-200,多國菜,海鮮,277,(462 食評),10771,訂座享8折優惠
Sabor Spanish Touch Private Kitchen,上環永樂街1-3號世瑛大廈6樓601室,$201-400,韓國菜,韓國菜,237,(259 食評),8523,送 25里數 / 30積分
Siam 28,銅鑼灣軒尼詩道525號澳門逸園中心28樓,$101-200,西班牙菜,私房菜,157,(185 食評),9237,"🍺啤酒, 紅白酒及有氣葡萄酒🍷《買一送一》"
巧得鍋 How Awesome,觀塘成業街15-17號成運工業大廈1樓12-14舖,$201-400,日本菜,火鍋,141,(181 食評),8812,訂座享八五折優惠(需晚上9點後入座)
Barg,銅鑼灣耀華街3號百樂中心1樓,$201-400,港式,火鍋,184,(216 食評),7357,送 25里數 / 30積分
Amici,中環士丹利街11號Stanley 11 8樓,$401-800,意大利菜,適合大夥人,146,(163 食評),7665,送 25里數 / 30積分
飲茶 Yum Cha,中環德輔道中173號南豐大廈2樓1-2號舖,$101-200,意大利菜,Fine Dining,104,(186 食評),16659,送 25里數 / 30積分
Spark Bar & Restaurant,中環蘭桂坊雲咸街29號LKF 29 4樓,$201-400,粵菜 (廣東),點心,170,(191 食評),8498,送 25里數 / 30積分
浜滝 Hamataki,九龍城福佬村道59號地下A舖,$201-400,意大利菜,海鮮,187,(227 食評),5428,送 25里數 / 30積分
Villa Villa,北角錦屏街後街25A號東發大廈地下31號舖,$101-200,日本菜,拉麵,168,(198 食評),8293,送 25里數 / 30積分
S2 鐵板燒 S2 Teppanyaki,佐敦偉晴街29-37號地下6號舖,$401-800,西式,薄餅,200,(210 食評),3852,送 25里數 / 30積分
備長 Bicho,銅鑼灣軒尼詩道525號澳門逸園中心26樓,$201-400,日本菜,鐵板燒,199,(242 食評),5988,送 25里數 / 30積分
